backend/.config/miopen/gfx1100_27.HIP.3_2_0_.ufdb.txt
1-1-3204-1x1-130-1-3204-16-0x0-1x1-1x1-0-NCHW-FP32-F=ConvBinWinogradRxSf2x3g1:0.0861848,0,miopenConvolutionFwdAlgoWinograd;ConvBinWinogradRxSf3x2:0.100297,0,miopenConvolutionFwdAlgoWinograd;GemmFwd1x1_0_1:0.0417586,0,miopenConvolutionFwdAlgoGEMM;ConvDirectNaiveConvFwd:0.198794,0,miopenConvolutionFwdAlgoDirect
1-1-3204-1x3-130-1-3204-16-0x1-1x1-1x1-0-NCHW-FP32-F=ConvBinWinogradRxSf2x3g1:0.0847128,0,miopenConvolutionFwdAlgoWinograd;ConvBinWinogradRxSf3x2:0.111105,0,miopenConvolutionFwdAlgoWinograd;GemmFwdRest:0.258971,38448,miopenConvolutionFwdAlgoGEMM;ConvDirectNaiveConvFwd:0.37682,0,miopenConvolutionFwdAlgoDirect
130-1-3204-1x3-130-1-3204-16-0x1-1x1-1x1-0-NCHW-FP32-F=ConvBinWinogradRxSf2x3g1:1.01056,0,miopenConvolutionFwdAlgoWinograd;ConvBinWinogradRxSf3x2:1.3893,0,miopenConvolutionFwdAlgoWinograd;GemmFwdRest:2.16348,4998240,miopenConvolutionFwdAlgoGEMM;ConvDirectNaiveConvFwd:37.1576,0,miopenConvolutionFwdAlgoDirect
130-1-1602-1x1-260-1-1602-16-0x0-1x1-1x1-0-NCHW-FP32-F=ConvBinWinogradRxSf2x3g1:1.02232,0,miopenConvolutionFwdAlgoWinograd;ConvBinWinogradRxSf3x2:0.603863,0,miopenConvolutionFwdAlgoWinograd;GemmFwd1x1_0_1:0.159002,0,miopenConvolutionFwdAlgoGEMM;ConvDirectNaiveConvFwd:15.0515,0,miopenConvolutionFwdAlgoDirect
130-1-1602-1x3-260-1-1602-16-0x1-1x1-1x1-0-NCHW-FP32-F=ConvBinWinogradRxSf2x3g1:0.940378,0,miopenConvolutionFwdAlgoWinograd;ConvBinWinogradRxSf3x2:1.22682,0,miopenConvolutionFwdAlgoWinograd;GemmFwdRest:1.6145,2499120,miopenConvolutionFwdAlgoGEMM;ConvDirectNaiveConvFwd:37.5069,0,miopenConvolutionFwdAlgoDirect
260-1-1602-1x3-260-1-1602-16-0x1-1x1-1x1-0-NCHW-FP32-F=ConvBinWinogradRxSf2x3g1:1.85584,0,miopenConvolutionFwdAlgoWinograd;ConvBinWinogradRxSf3x2:2.41856,0,miopenConvolutionFwdAlgoWinograd;GemmFwdRest:2.74169,4998240,miopenConvolutionFwdAlgoGEMM;ConvDirectNaiveConvFwd:76.0555,0,miopenConvolutionFwdAlgoDirect
260-1-1602-1x3-260-1-1602-16-0x1-1x1-1x1-0-NCHW-FP32-B=ConvBinWinogradRxSf2x3g1:1.90679,0,miopenConvolutionBwdDataAlgoWinograd;ConvBinWinogradRxSf3x2:3.27808,0,miopenConvolutionBwdDataAlgoWinograd;GemmBwdRest:2.27131,4998240,miopenConvolutionBwdDataAlgoGEMM;ConvDirectNaiveConvBwd:122.035,0,miopenConvolutionBwdDataAlgoDirect
260-1-1602-1x3-260-1-1602-16-0x1-1x1-1x1-0-NCHW-FP32-W=ConvBinWinogradRxSf2x3g1:2.91287,0,miopenConvolutionBwdWeightsAlgoWinograd;ConvBinWinogradRxSf2x3:2.88615,0,miopenConvolutionBwdWeightsAlgoWinograd;ConvBinWinogradRxSf3x2:2.85817,0,miopenConvolutionBwdWeightsAlgoWinograd;GemmWrwUniversal:6.07938,4998240,miopenConvolutionBwdWeightsAlgoGEMM;ConvDirectNaiveConvWrw:90.8441,0,miopenConvolutionBwdWeightsAlgoDirect
260-1-1602-1x3-130-1-1602-16-0x1-1x1-1x1-0-NCHW-FP32-B=ConvBinWinogradRxSf2x3g1:2.15295,0,miopenConvolutionBwdDataAlgoWinograd;ConvBinWinogradRxSf3x2:1.31032,0,miopenConvolutionBwdDataAlgoWinograd;GemmBwdRest:0.944018,2499120,miopenConvolutionBwdDataAlgoGEMM;ConvDirectNaiveConvBwd:55.1208,0,miopenConvolutionBwdDataAlgoDirect
260-1-1602-1x3-130-1-1602-16-0x1-1x1-1x1-0-NCHW-FP32-W=ConvBinWinogradRxSf2x3g1:1.98285,0,miopenConvolutionBwdWeightsAlgoWinograd;ConvBinWinogradRxSf2x3:1.95029,0,miopenConvolutionBwdWeightsAlgoWinograd;ConvBinWinogradRxSf3x2:1.37801,0,miopenConvolutionBwdWeightsAlgoWinograd;GemmWrwUniversal:2.71385,2499120,miopenConvolutionBwdWeightsAlgoGEMM;ConvDirectNaiveConvWrw:48.8492,0,miopenConvolutionBwdWeightsAlgoDirect
260-1-1602-1x1-130-1-1602-16-0x0-1x1-1x1-0-NCHW-FP32-B=ConvBinWinogradRxSf2x3g1:1.06911,0,miopenConvolutionBwdDataAlgoWinograd;ConvBinWinogradRxSf3x2:0.652111,0,miopenConvolutionBwdDataAlgoWinograd;GemmBwd1x1_stride1:0.279699,0,miopenConvolutionBwdDataAlgoGEMM;ConvDirectNaiveConvBwd:22.4569,0,miopenConvolutionBwdDataAlgoDirect
260-1-1602-1x1-130-1-1602-16-0x0-1x1-1x1-0-NCHW-FP32-W=ConvBinWinogradRxSf2x3:0.979595,0,miopenConvolutionBwdWeightsAlgoWinograd;ConvBinWinogradRxSf3x2:1.38687,0,miopenConvolutionBwdWeightsAlgoWinograd;ConvBinWinogradRxSf2x3g1:0.984515,0,miopenConvolutionBwdWeightsAlgoWinograd;GemmWrw1x1_stride1:1.77139,0,miopenConvolutionBwdWeightsAlgoGEMM;ConvDirectNaiveConvWrw:35.18,0,miopenConvolutionBwdWeightsAlgoDirect
130-1-3204-1x3-130-1-3204-16-0x1-1x1-1x1-0-NCHW-FP32-B=ConvBinWinogradRxSf2x3g1:1.07256,0,miopenConvolutionBwdDataAlgoWinograd;ConvBinWinogradRxSf3x2:1.36306,0,miopenConvolutionBwdDataAlgoWinograd;GemmBwdRest:0.993659,4998240,miopenConvolutionBwdDataAlgoGEMM;ConvDirectNaiveConvBwd:54.9487,0,miopenConvolutionBwdDataAlgoDirect
130-1-3204-1x3-130-1-3204-16-0x1-1x1-1x1-0-NCHW-FP32-W=ConvBinWinogradRxSf2x3g1:1.97526,0,miopenConvolutionBwdWeightsAlgoWinograd;ConvBinWinogradRxSf2x3:1.95747,0,miopenConvolutionBwdWeightsAlgoWinograd;ConvBinWinogradRxSf3x2:2.86542,0,miopenConvolutionBwdWeightsAlgoWinograd;GemmWrwUniversal:4.24492,4998240,miopenConvolutionBwdWeightsAlgoGEMM;ConvDirectNaiveConvWrw:53.3865,0,miopenConvolutionBwdWeightsAlgoDirect
130-1-3204-1x3-1-1-3204-16-0x1-1x1-1x1-0-NCHW-FP32-W=ConvBinWinogradRxSf2x3g1:1.95877,0,miopenConvolutionBwdWeightsAlgoWinograd;ConvBinWinogradRxSf2x3:1.9346,0,miopenConvolutionBwdWeightsAlgoWinograd;ConvBinWinogradRxSf3x2:3.15543,0,miopenConvolutionBwdWeightsAlgoWinograd;GemmWrwUniversal:3.50834,38448,miopenConvolutionBwdWeightsAlgoGEMM;ConvDirectNaiveConvWrw:13.358,0,miopenConvolutionBwdWeightsAlgoDirect
130-1-3204-1x1-1-1-3204-16-0x0-1x1-1x1-0-NCHW-FP32-W=ConvBinWinogradRxSf2x3:1.87355,0,miopenConvolutionBwdWeightsAlgoWinograd;ConvBinWinogradRxSf3x2:3.44258,0,miopenConvolutionBwdWeightsAlgoWinograd;ConvBinWinogradRxSf2x3g1:1.98922,0,miopenConvolutionBwdWeightsAlgoWinograd;GemmWrw1x1_stride1:3.3523,0,miopenConvolutionBwdWeightsAlgoGEMM;ConvDirectNaiveConvWrw:14.0138,0,miopenConvolutionBwdWeightsAlgoDirect
1-1-3204-1x1-130-1-3204-10-0x0-1x1-1x1-0-NCHW-FP32-F=ConvBinWinogradRxSf2x3g1:0.0615446,0,miopenConvolutionFwdAlgoWinograd;ConvBinWinogradRxSf3x2:0.072129,0,miopenConvolutionFwdAlgoWinograd;GemmFwd1x1_0_1:0.0293124,0,miopenConvolutionFwdAlgoGEMM;ConvDirectNaiveConvFwd:0.178474,0,miopenConvolutionFwdAlgoDirect
1-1-3204-1x3-130-1-3204-10-0x1-1x1-1x1-0-NCHW-FP32-F=ConvBinWinogradRxSf2x3g1:0.094113,0,miopenConvolutionFwdAlgoWinograd;ConvBinWinogradRxSf3x2:0.112281,0,miopenConvolutionFwdAlgoWinograd;GemmFwdRest:0.232235,38448,miopenConvolutionFwdAlgoGEMM;ConvDirectNaiveConvFwd:0.394988,0,miopenConvolutionFwdAlgoDirect
130-1-3204-1x3-130-1-3204-10-0x1-1x1-1x1-0-NCHW-FP32-F=ConvBinWinogradRxSf2x3g1:0.76184,0,miopenConvolutionFwdAlgoWinograd;ConvBinWinogradRxSf3x2:0.864881,0,miopenConvolutionFwdAlgoWinograd;GemmFwdRest:1.54561,4998240,miopenConvolutionFwdAlgoGEMM;ConvDirectNaiveConvFwd:24.8847,0,miopenConvolutionFwdAlgoDirect
130-1-1602-1x1-260-1-1602-10-0x0-1x1-1x1-0-NCHW-FP32-F=ConvBinWinogradRxSf2x3g1:0.616375,0,miopenConvolutionFwdAlgoWinograd;ConvBinWinogradRxSf3x2:0.493333,0,miopenConvolutionFwdAlgoWinograd;GemmFwd1x1_0_1:0.111314,0,miopenConvolutionFwdAlgoGEMM;ConvDirectNaiveConvFwd:10.3796,0,miopenConvolutionFwdAlgoDirect
130-1-1602-1x3-260-1-1602-10-0x1-1x1-1x1-0-NCHW-FP32-F=ConvBinWinogradRxSf2x3g1:0.642735,0,miopenConvolutionFwdAlgoWinograd;ConvBinWinogradRxSf3x2:0.772024,0,miopenConvolutionFwdAlgoWinograd;GemmFwdRest:1.18651,2499120,miopenConvolutionFwdAlgoGEMM;ConvDirectNaiveConvFwd:24.4084,0,miopenConvolutionFwdAlgoDirect
260-1-1602-1x3-260-1-1602-10-0x1-1x1-1x1-0-NCHW-FP32-F=ConvBinWinogradRxSf2x3g1:1.24855,0,miopenConvolutionFwdAlgoWinograd;ConvBinWinogradRxSf3x2:1.45245,0,miopenConvolutionFwdAlgoWinograd;GemmFwdRest:1.71904,4998240,miopenConvolutionFwdAlgoGEMM;ConvDirectNaiveConvFwd:50.8104,0,miopenConvolutionFwdAlgoDirect
260-1-1602-1x3-260-1-1602-10-0x1-1x1-1x1-0-NCHW-FP32-B=ConvBinWinogradRxSf2x3g1:1.19865,0,miopenConvolutionBwdDataAlgoWinograd;ConvBinWinogradRxSf3x2:1.55231,0,miopenConvolutionBwdDataAlgoWinograd;GemmBwdRest:1.0892,4998240,miopenConvolutionBwdDataAlgoGEMM;ConvDirectNaiveConvBwd:72.735,0,miopenConvolutionBwdDataAlgoDirect
260-1-1602-1x3-260-1-1602-10-0x1-1x1-1x1-0-NCHW-FP32-W=ConvBinWinogradRxSf2x3g1:2.01312,0,miopenConvolutionBwdWeightsAlgoWinograd;ConvBinWinogradRxSf2x3:2.0139,0,miopenConvolutionBwdWeightsAlgoWinograd;ConvBinWinogradRxSf3x2:1.86772,0,miopenConvolutionBwdWeightsAlgoWinograd;GemmWrwUniversal:2.90318,4998240,miopenConvolutionBwdWeightsAlgoGEMM;ConvDirectNaiveConvWrw:59.2934,0,miopenConvolutionBwdWeightsAlgoDirect
260-1-1602-1x3-130-1-1602-10-0x1-1x1-1x1-0-NCHW-FP32-B=ConvBinWinogradRxSf2x3g1:0.74852,0,miopenConvolutionBwdDataAlgoWinograd;ConvBinWinogradRxSf3x2:0.837417,0,miopenConvolutionBwdDataAlgoWinograd;GemmBwdRest:0.760992,2499120,miopenConvolutionBwdDataAlgoGEMM;ConvDirectNaiveConvBwd:35.4264,0,miopenConvolutionBwdDataAlgoDirect
260-1-1602-1x3-130-1-1602-10-0x1-1x1-1x1-0-NCHW-FP32-W=ConvBinWinogradRxSf2x3g1:1.37092,0,miopenConvolutionBwdWeightsAlgoWinograd;ConvBinWinogradRxSf2x3:1.32506,0,miopenConvolutionBwdWeightsAlgoWinograd;ConvBinWinogradRxSf3x2:0.918938,0,miopenConvolutionBwdWeightsAlgoWinograd;GemmWrwUniversal:1.67958,2499120,miopenConvolutionBwdWeightsAlgoGEMM;ConvDirectNaiveConvWrw:31.1477,0,miopenConvolutionBwdWeightsAlgoDirect
260-1-1602-1x1-130-1-1602-10-0x0-1x1-1x1-0-NCHW-FP32-B=ConvBinWinogradRxSf2x3g1:0.638999,0,miopenConvolutionBwdDataAlgoWinograd;ConvBinWinogradRxSf3x2:0.426292,0,miopenConvolutionBwdDataAlgoWinograd;GemmBwd1x1_stride1:0.176162,0,miopenConvolutionBwdDataAlgoGEMM;ConvDirectNaiveConvBwd:15.0184,0,miopenConvolutionBwdDataAlgoDirect
260-1-1602-1x1-130-1-1602-10-0x0-1x1-1x1-0-NCHW-FP32-W=ConvBinWinogradRxSf2x3:0.644095,0,miopenConvolutionBwdWeightsAlgoWinograd;ConvBinWinogradRxSf3x2:0.858337,0,miopenConvolutionBwdWeightsAlgoWinograd;ConvBinWinogradRxSf2x3g1:0.647759,0,miopenConvolutionBwdWeightsAlgoWinograd;GemmWrw1x1_stride1:1.10996,0,miopenConvolutionBwdWeightsAlgoGEMM;ConvDirectNaiveConvWrw:21.462,0,miopenConvolutionBwdWeightsAlgoDirect
130-1-3204-1x3-130-1-3204-10-0x1-1x1-1x1-0-NCHW-FP32-B=ConvBinWinogradRxSf2x3g1:0.703616,0,miopenConvolutionBwdDataAlgoWinograd;ConvBinWinogradRxSf3x2:0.801256,0,miopenConvolutionBwdDataAlgoWinograd;GemmBwdRest:0.611773,4998240,miopenConvolutionBwdDataAlgoGEMM;ConvDirectNaiveConvBwd:34.9309,0,miopenConvolutionBwdDataAlgoDirect
130-1-3204-1x3-130-1-3204-10-0x1-1x1-1x1-0-NCHW-FP32-W=ConvBinWinogradRxSf2x3g1:1.29342,0,miopenConvolutionBwdWeightsAlgoWinograd;ConvBinWinogradRxSf2x3:1.26249,0,miopenConvolutionBwdWeightsAlgoWinograd;ConvBinWinogradRxSf3x2:1.82462,0,miopenConvolutionBwdWeightsAlgoWinograd;GemmWrwUniversal:2.41495,4998240,miopenConvolutionBwdWeightsAlgoGEMM;ConvDirectNaiveConvWrw:32.1266,0,miopenConvolutionBwdWeightsAlgoDirect
130-1-3204-1x3-1-1-3204-10-0x1-1x1-1x1-0-NCHW-FP32-W=ConvBinWinogradRxSf2x3g1:1.32435,0,miopenConvolutionBwdWeightsAlgoWinograd;ConvBinWinogradRxSf2x3:1.30942,0,miopenConvolutionBwdWeightsAlgoWinograd;ConvBinWinogradRxSf3x2:1.73155,0,miopenConvolutionBwdWeightsAlgoWinograd;GemmWrwUniversal:1.53777,38448,miopenConvolutionBwdWeightsAlgoGEMM;ConvDirectNaiveConvWrw:9.48649,0,miopenConvolutionBwdWeightsAlgoDirect
130-1-3204-1x1-1-1-3204-10-0x0-1x1-1x1-0-NCHW-FP32-W=ConvBinWinogradRxSf2x3:1.13464,0,miopenConvolutionBwdWeightsAlgoWinograd;ConvBinWinogradRxSf3x2:1.78736,0,miopenConvolutionBwdWeightsAlgoWinograd;ConvBinWinogradRxSf2x3g1:1.28109,0,miopenConvolutionBwdWeightsAlgoWinograd;GemmWrw1x1_stride1:1.47043,0,miopenConvolutionBwdWeightsAlgoGEMM;ConvDirectNaiveConvWrw:10.9211,0,miopenConvolutionBwdWeightsAlgoDirect
1-1-3204-1x1-130-1-3204-17-0x0-1x1-1x1-0-NCHW-FP32-F=ConvBinWinogradRxSf2x3g1:0.141577,0,miopenConvolutionFwdAlgoWinograd;ConvBinWinogradRxSf3x2:0.165466,0,miopenConvolutionFwdAlgoWinograd;GemmFwd1x1_0_1:0.0535526,0,miopenConvolutionFwdAlgoGEMM;ConvDirectNaiveConvFwd:0.321724,0,miopenConvolutionFwdAlgoDirect
1-1-3204-1x3-130-1-3204-17-0x1-1x1-1x1-0-NCHW-FP32-F=ConvBinWinogradRxSf2x3g1:0.140474,0,miopenConvolutionFwdAlgoWinograd;ConvBinWinogradRxSf3x2:0.183186,0,miopenConvolutionFwdAlgoWinograd;GemmFwdRest:0.365388,38448,miopenConvolutionFwdAlgoGEMM;ConvDirectNaiveConvFwd:0.615311,0,miopenConvolutionFwdAlgoDirect
130-1-3204-1x3-130-1-3204-17-0x1-1x1-1x1-0-NCHW-FP32-F=ConvBinWinogradRxSf2x3g1:1.13412,0,miopenConvolutionFwdAlgoWinograd;ConvBinWinogradRxSf3x2:1.44863,0,miopenConvolutionFwdAlgoWinograd;GemmFwdRest:2.36961,4998240,miopenConvolutionFwdAlgoGEMM;ConvDirectNaiveConvFwd:40.923,0,miopenConvolutionFwdAlgoDirect
130-1-1602-1x1-260-1-1602-17-0x0-1x1-1x1-0-NCHW-FP32-F=ConvBinWinogradRxSf2x3g1:1.07699,0,miopenConvolutionFwdAlgoWinograd;ConvBinWinogradRxSf3x2:0.667608,0,miopenConvolutionFwdAlgoWinograd;GemmFwd1x1_0_1:0.177362,0,miopenConvolutionFwdAlgoGEMM;ConvDirectNaiveConvFwd:18.0766,0,miopenConvolutionFwdAlgoDirect
130-1-1602-1x3-260-1-1602-17-0x1-1x1-1x1-0-NCHW-FP32-F=ConvBinWinogradRxSf2x3g1:1.00903,0,miopenConvolutionFwdAlgoWinograd;ConvBinWinogradRxSf3x2:1.29566,0,miopenConvolutionFwdAlgoWinograd;GemmFwdRest:1.73054,2499120,miopenConvolutionFwdAlgoGEMM;ConvDirectNaiveConvFwd:41.1146,0,miopenConvolutionFwdAlgoDirect
260-1-1602-1x3-260-1-1602-17-0x1-1x1-1x1-0-NCHW-FP32-F=ConvBinWinogradRxSf2x3g1:1.95257,0,miopenConvolutionFwdAlgoWinograd;ConvBinWinogradRxSf3x2:2.55693,0,miopenConvolutionFwdAlgoWinograd;GemmFwdRest:3.01408,4998240,miopenConvolutionFwdAlgoGEMM;ConvDirectNaiveConvFwd:82.3196,0,miopenConvolutionFwdAlgoDirect
1-1-3204-1x1-659-1-3204-16-0x0-1x1-1x1-0-NCHW-FP32-F=ConvBinWinogradRxSf2x3g1:0.7222,0,miopenConvolutionFwdAlgoWinograd;ConvBinWinogradRxSf3x2:0.639759,0,miopenConvolutionFwdAlgoWinograd;GemmFwd1x1_0_1:0.385428,0,miopenConvolutionFwdAlgoGEMM;ConvDirectNaiveConvFwd:1.48971,0,miopenConvolutionFwdAlgoDirect
1-1-3204-1x3-659-1-3204-16-0x1-1x1-1x1-0-NCHW-FP32-F=ConvBinWinogradRxSf2x3g1:0.748464,0,miopenConvolutionFwdAlgoWinograd;ConvBinWinogradRxSf3x2:0.654584,0,miopenConvolutionFwdAlgoWinograd;GemmFwdRest:0.648376,38448,miopenConvolutionFwdAlgoGEMM;ConvDirectNaiveConvFwd:2.83093,0,miopenConvolutionFwdAlgoDirect
659-1-3204-1x3-659-1-3204-16-0x1-1x1-1x1-0-NCHW-FP32-F=ConvBinWinogradRxSf2x3g1:22.242,0,miopenConvolutionFwdAlgoWinograd;ConvBinWinogradRxSf3x2:29.1068,0,miopenConvolutionFwdAlgoWinograd;GemmFwdRest:18.4854,25337232,miopenConvolutionFwdAlgoGEMM;ConvDirectNaiveConvFwd:945.556,0,miopenConvolutionFwdAlgoDirect
659-1-1602-1x1-932-1-1602-16-0x0-1x1-1x1-0-NCHW-FP32-F=ConvBinWinogradRxSf2x3g1:15.7582,0,miopenConvolutionFwdAlgoWinograd;ConvBinWinogradRxSf3x2:10.6474,0,miopenConvolutionFwdAlgoWinograd;GemmFwd1x1_0_1:2.66311,0,miopenConvolutionFwdAlgoGEMM;ConvDirectNaiveConvFwd:251.517,0,miopenConvolutionFwdAlgoDirect
659-1-1602-1x3-932-1-1602-16-0x1-1x1-1x1-0-NCHW-FP32-F=ConvBinWinogradRxSf2x3g1:15.875,0,miopenConvolutionFwdAlgoWinograd;ConvBinWinogradRxSf3x2:20.9124,0,miopenConvolutionFwdAlgoWinograd;GemmFwdRest:11.4905,12668616,miopenConvolutionFwdAlgoGEMM;ConvDirectNaiveConvFwd:661.711,0,miopenConvolutionFwdAlgoDirect
932-1-1602-1x3-932-1-1602-16-0x1-1x1-1x1-0-NCHW-FP32-F=ConvBinWinogradRxSf2x3g1:22.3562,0,miopenConvolutionFwdAlgoWinograd;ConvBinWinogradRxSf3x2:29.2253,0,miopenConvolutionFwdAlgoWinograd;GemmFwdRest:15.2955,17916768,miopenConvolutionFwdAlgoGEMM;ConvDirectNaiveConvFwd:956.564,0,miopenConvolutionFwdAlgoDirect
932-1-1602-1x3-932-1-1602-16-0x1-1x1-1x1-0-NCHW-FP32-B=ConvBinWinogradRxSf2x3g1:22.5041,0,miopenConvolutionBwdDataAlgoWinograd;ConvBinWinogradRxSf3x2:29.5512,0,miopenConvolutionBwdDataAlgoWinograd;GemmBwdRest:12.4134,17916768,miopenConvolutionBwdDataAlgoGEMM;ConvDirectNaiveConvBwd:1338.52,0,miopenConvolutionBwdDataAlgoDirect
932-1-1602-1x3-932-1-1602-16-0x1-1x1-1x1-0-NCHW-FP32-W=ConvBinWinogradRxSf2x3g1:34.1899,0,miopenConvolutionBwdWeightsAlgoWinograd;ConvBinWinogradRxSf2x3:33.965,0,miopenConvolutionBwdWeightsAlgoWinograd;ConvBinWinogradRxSf3x2:30.3141,0,miopenConvolutionBwdWeightsAlgoWinograd;GemmWrwUniversal:15.9455,17916768,miopenConvolutionBwdWeightsAlgoGEMM;ConvDirectNaiveConvWrw:875.983,0,miopenConvolutionBwdWeightsAlgoDirect
932-1-1602-1x3-659-1-1602-16-0x1-1x1-1x1-0-NCHW-FP32-B=ConvBinWinogradRxSf2x3g1:15.7715,0,miopenConvolutionBwdDataAlgoWinograd;ConvBinWinogradRxSf3x2:20.7286,0,miopenConvolutionBwdDataAlgoWinograd;GemmBwdRest:8.05726,12668616,miopenConvolutionBwdDataAlgoGEMM;ConvDirectNaiveConvBwd:948.017,0,miopenConvolutionBwdDataAlgoDirect
932-1-1602-1x3-659-1-1602-16-0x1-1x1-1x1-0-NCHW-FP32-W=ConvBinWinogradRxSf2x3g1:25.1692,0,miopenConvolutionBwdWeightsAlgoWinograd;ConvBinWinogradRxSf2x3:25.2493,0,miopenConvolutionBwdWeightsAlgoWinograd;ConvBinWinogradRxSf3x2:18.3957,0,miopenConvolutionBwdWeightsAlgoWinograd;GemmWrwUniversal:12.9627,12668616,miopenConvolutionBwdWeightsAlgoGEMM;ConvDirectNaiveConvWrw:645.988,0,miopenConvolutionBwdWeightsAlgoDirect
932-1-1602-1x1-659-1-1602-16-0x0-1x1-1x1-0-NCHW-FP32-B=ConvBinWinogradRxSf2x3g1:15.5585,0,miopenConvolutionBwdDataAlgoWinograd;ConvBinWinogradRxSf3x2:10.5086,0,miopenConvolutionBwdDataAlgoWinograd;GemmBwd1x1_stride1:2.87998,0,miopenConvolutionBwdDataAlgoGEMM;ConvDirectNaiveConvBwd:391.194,0,miopenConvolutionBwdDataAlgoDirect
932-1-1602-1x1-659-1-1602-16-0x0-1x1-1x1-0-NCHW-FP32-W=ConvBinWinogradRxSf2x3:12.8326,0,miopenConvolutionBwdWeightsAlgoWinograd;ConvBinWinogradRxSf3x2:18.5298,0,miopenConvolutionBwdWeightsAlgoWinograd;ConvBinWinogradRxSf2x3g1:12.8455,0,miopenConvolutionBwdWeightsAlgoWinograd;GemmWrw1x1_stride1:3.76401,0,miopenConvolutionBwdWeightsAlgoGEMM;ConvDirectNaiveConvWrw:905.681,0,miopenConvolutionBwdWeightsAlgoDirect
659-1-3204-1x3-659-1-3204-16-0x1-1x1-1x1-0-NCHW-FP32-B=ConvBinWinogradRxSf2x3g1:22.4158,0,miopenConvolutionBwdDataAlgoWinograd;ConvBinWinogradRxSf3x2:29.0731,0,miopenConvolutionBwdDataAlgoWinograd;GemmBwdRest:12.4237,25337232,miopenConvolutionBwdDataAlgoGEMM;ConvDirectNaiveConvBwd:1343.73,0,miopenConvolutionBwdDataAlgoDirect
659-1-3204-1x3-659-1-3204-16-0x1-1x1-1x1-0-NCHW-FP32-W=ConvBinWinogradRxSf2x3g1:38.3078,0,miopenConvolutionBwdWeightsAlgoWinograd;ConvBinWinogradRxSf2x3:38.6409,0,miopenConvolutionBwdWeightsAlgoWinograd;ConvBinWinogradRxSf3x2:28.2208,0,miopenConvolutionBwdWeightsAlgoWinograd;GemmWrwUniversal:19.9989,25337232,miopenConvolutionBwdWeightsAlgoGEMM;ConvDirectNaiveConvWrw:930.429,0,miopenConvolutionBwdWeightsAlgoDirect
659-1-3204-1x3-1-1-3204-16-0x1-1x1-1x1-0-NCHW-FP32-W=ConvBinWinogradRxSf2x3g1:2.06818,0,miopenConvolutionBwdWeightsAlgoWinograd;ConvBinWinogradRxSf2x3:2.07394,0,miopenConvolutionBwdWeightsAlgoWinograd;ConvBinWinogradRxSf3x2:3.29563,0,miopenConvolutionBwdWeightsAlgoWinograd;GemmWrwUniversal:2.99187,38448,miopenConvolutionBwdWeightsAlgoGEMM;ConvDirectNaiveConvWrw:58.1925,0,miopenConvolutionBwdWeightsAlgoDirect
659-1-3204-1x1-1-1-3204-16-0x0-1x1-1x1-0-NCHW-FP32-W=ConvBinWinogradRxSf2x3:2.07037,0,miopenConvolutionBwdWeightsAlgoWinograd;ConvBinWinogradRxSf3x2:3.41549,0,miopenConvolutionBwdWeightsAlgoWinograd;ConvBinWinogradRxSf2x3g1:2.02978,0,miopenConvolutionBwdWeightsAlgoWinograd;GemmWrw1x1_stride1:2.91203,0,miopenConvolutionBwdWeightsAlgoGEMM;ConvDirectNaiveConvWrw:59.1137,0,miopenConvolutionBwdWeightsAlgoDirect
1-1-3204-1x1-659-1-3204-10-0x0-1x1-1x1-0-NCHW-FP32-F=ConvBinWinogradRxSf2x3g1:0.461365,0,miopenConvolutionFwdAlgoWinograd;ConvBinWinogradRxSf3x2:0.541798,0,miopenConvolutionFwdAlgoWinograd;GemmFwd1x1_0_1:0.248883,0,miopenConvolutionFwdAlgoGEMM;ConvDirectNaiveConvFwd:0.728704,0,miopenConvolutionFwdAlgoDirect
1-1-3204-1x3-659-1-3204-10-0x1-1x1-1x1-0-NCHW-FP32-F=ConvBinWinogradRxSf2x3g1:0.512638,0,miopenConvolutionFwdAlgoWinograd;ConvBinWinogradRxSf3x2:0.484462,0,miopenConvolutionFwdAlgoWinograd;GemmFwdRest:0.474382,38448,miopenConvolutionFwdAlgoGEMM;ConvDirectNaiveConvFwd:1.85892,0,miopenConvolutionFwdAlgoDirect
659-1-3204-1x3-659-1-3204-10-0x1-1x1-1x1-0-NCHW-FP32-F=ConvBinWinogradRxSf2x3g1:14.0091,0,miopenConvolutionFwdAlgoWinograd;ConvBinWinogradRxSf3x2:17.7708,0,miopenConvolutionFwdAlgoWinograd;GemmFwdRest:11.0016,25337232,miopenConvolutionFwdAlgoGEMM;ConvDirectNaiveConvFwd:590.18,0,miopenConvolutionFwdAlgoDirect
659-1-1602-1x1-932-1-1602-10-0x0-1x1-1x1-0-NCHW-FP32-F=ConvBinWinogradRxSf2x3g1:9.98173,0,miopenConvolutionFwdAlgoWinograd;ConvBinWinogradRxSf3x2:6.53019,0,miopenConvolutionFwdAlgoWinograd;GemmFwd1x1_0_1:1.63759,0,miopenConvolutionFwdAlgoGEMM;ConvDirectNaiveConvFwd:157.835,0,miopenConvolutionFwdAlgoDirect
659-1-1602-1x3-932-1-1602-10-0x1-1x1-1x1-0-NCHW-FP32-F=ConvBinWinogradRxSf2x3g1:10.025,0,miopenConvolutionFwdAlgoWinograd;ConvBinWinogradRxSf3x2:12.8798,0,miopenConvolutionFwdAlgoWinograd;GemmFwdRest:7.05632,12668616,miopenConvolutionFwdAlgoGEMM;ConvDirectNaiveConvFwd:411.387,0,miopenConvolutionFwdAlgoDirect
932-1-1602-1x3-932-1-1602-10-0x1-1x1-1x1-0-NCHW-FP32-F=ConvBinWinogradRxSf2x3g1:14.0551,0,miopenConvolutionFwdAlgoWinograd;ConvBinWinogradRxSf3x2:18.0702,0,miopenConvolutionFwdAlgoWinograd;GemmFwdRest:9.64326,17916768,miopenConvolutionFwdAlgoGEMM;ConvDirectNaiveConvFwd:577.424,0,miopenConvolutionFwdAlgoDirect
932-1-1602-1x3-932-1-1602-10-0x1-1x1-1x1-0-NCHW-FP32-B=ConvBinWinogradRxSf2x3g1:14.1504,0,miopenConvolutionBwdDataAlgoWinograd;ConvBinWinogradRxSf3x2:18.5284,0,miopenConvolutionBwdDataAlgoWinograd;GemmBwdRest:7.62474,17916768,miopenConvolutionBwdDataAlgoGEMM;ConvDirectNaiveConvBwd:838.81,0,miopenConvolutionBwdDataAlgoDirect
932-1-1602-1x3-932-1-1602-10-0x1-1x1-1x1-0-NCHW-FP32-W=ConvBinWinogradRxSf2x3g1:21.9825,0,miopenConvolutionBwdWeightsAlgoWinograd;ConvBinWinogradRxSf2x3:21.9396,0,miopenConvolutionBwdWeightsAlgoWinograd;ConvBinWinogradRxSf3x2:18.1974,0,miopenConvolutionBwdWeightsAlgoWinograd;GemmWrwUniversal:9.83307,17916768,miopenConvolutionBwdWeightsAlgoGEMM;ConvDirectNaiveConvWrw:547.894,0,miopenConvolutionBwdWeightsAlgoDirect
932-1-1602-1x3-659-1-1602-10-0x1-1x1-1x1-0-NCHW-FP32-B=ConvBinWinogradRxSf2x3g1:9.9681,0,miopenConvolutionBwdDataAlgoWinograd;ConvBinWinogradRxSf3x2:12.9176,0,miopenConvolutionBwdDataAlgoWinograd;GemmBwdRest:5.23175,12668616,miopenConvolutionBwdDataAlgoGEMM;ConvDirectNaiveConvBwd:594.293,0,miopenConvolutionBwdDataAlgoDirect
932-1-1602-1x3-659-1-1602-10-0x1-1x1-1x1-0-NCHW-FP32-W=ConvBinWinogradRxSf2x3g1:16.3873,0,miopenConvolutionBwdWeightsAlgoWinograd;ConvBinWinogradRxSf2x3:15.5007,0,miopenConvolutionBwdWeightsAlgoWinograd;ConvBinWinogradRxSf3x2:11.7896,0,miopenConvolutionBwdWeightsAlgoWinograd;GemmWrwUniversal:7.93356,12668616,miopenConvolutionBwdWeightsAlgoGEMM;ConvDirectNaiveConvWrw:404.028,0,miopenConvolutionBwdWeightsAlgoDirect
932-1-1602-1x1-659-1-1602-10-0x0-1x1-1x1-0-NCHW-FP32-B=ConvBinWinogradRxSf2x3g1:9.90237,0,miopenConvolutionBwdDataAlgoWinograd;ConvBinWinogradRxSf3x2:6.36413,0,miopenConvolutionBwdDataAlgoWinograd;GemmBwd1x1_stride1:1.71328,0,miopenConvolutionBwdDataAlgoGEMM;ConvDirectNaiveConvBwd:244.152,0,miopenConvolutionBwdDataAlgoDirect
932-1-1602-1x1-659-1-1602-10-0x0-1x1-1x1-0-NCHW-FP32-W=ConvBinWinogradRxSf2x3:8.16184,0,miopenConvolutionBwdWeightsAlgoWinograd;ConvBinWinogradRxSf3x2:11.5637,0,miopenConvolutionBwdWeightsAlgoWinograd;ConvBinWinogradRxSf2x3g1:8.21197,0,miopenConvolutionBwdWeightsAlgoWinograd;GemmWrw1x1_stride1:2.29038,0,miopenConvolutionBwdWeightsAlgoGEMM;ConvDirectNaiveConvWrw:529.646,0,miopenConvolutionBwdWeightsAlgoDirect
659-1-3204-1x3-659-1-3204-10-0x1-1x1-1x1-0-NCHW-FP32-B=ConvBinWinogradRxSf2x3g1:13.6413,0,miopenConvolutionBwdDataAlgoWinograd;ConvBinWinogradRxSf3x2:18.1994,0,miopenConvolutionBwdDataAlgoWinograd;GemmBwdRest:7.81775,25337232,miopenConvolutionBwdDataAlgoGEMM;ConvDirectNaiveConvBwd:844.495,0,miopenConvolutionBwdDataAlgoDirect
659-1-3204-1x3-659-1-3204-10-0x1-1x1-1x1-0-NCHW-FP32-W=ConvBinWinogradRxSf2x3g1:23.7452,0,miopenConvolutionBwdWeightsAlgoWinograd;ConvBinWinogradRxSf2x3:23.8255,0,miopenConvolutionBwdWeightsAlgoWinograd;ConvBinWinogradRxSf3x2:17.599,0,miopenConvolutionBwdWeightsAlgoWinograd;GemmWrwUniversal:12.2775,25337232,miopenConvolutionBwdWeightsAlgoGEMM;ConvDirectNaiveConvWrw:579.595,0,miopenConvolutionBwdWeightsAlgoDirect
659-1-3204-1x3-1-1-3204-10-0x1-1x1-1x1-0-NCHW-FP32-W=ConvBinWinogradRxSf2x3g1:1.36381,0,miopenConvolutionBwdWeightsAlgoWinograd;ConvBinWinogradRxSf2x3:1.26217,0,miopenConvolutionBwdWeightsAlgoWinograd;ConvBinWinogradRxSf3x2:1.90125,0,miopenConvolutionBwdWeightsAlgoWinograd;GemmWrwUniversal:1.42357,38448,miopenConvolutionBwdWeightsAlgoGEMM;ConvDirectNaiveConvWrw:36.5992,0,miopenConvolutionBwdWeightsAlgoDirect
659-1-3204-1x1-1-1-3204-10-0x0-1x1-1x1-0-NCHW-FP32-W=ConvBinWinogradRxSf2x3:1.21808,0,miopenConvolutionBwdWeightsAlgoWinograd;ConvBinWinogradRxSf3x2:1.88466,0,miopenConvolutionBwdWeightsAlgoWinograd;ConvBinWinogradRxSf2x3g1:1.33164,0,miopenConvolutionBwdWeightsAlgoWinograd;GemmWrw1x1_stride1:1.34271,0,miopenConvolutionBwdWeightsAlgoGEMM;ConvDirectNaiveConvWrw:36.3298,0,miopenConvolutionBwdWeightsAlgoDirect
1-1-3204-1x1-659-1-3204-17-0x0-1x1-1x1-0-NCHW-FP32-F=ConvBinWinogradRxSf2x3g1:0.769713,0,miopenConvolutionFwdAlgoWinograd;ConvBinWinogradRxSf3x2:0.743577,0,miopenConvolutionFwdAlgoWinograd;GemmFwd1x1_0_1:0.398645,0,miopenConvolutionFwdAlgoGEMM;ConvDirectNaiveConvFwd:1.10025,0,miopenConvolutionFwdAlgoDirect
1-1-3204-1x3-659-1-3204-17-0x1-1x1-1x1-0-NCHW-FP32-F=ConvBinWinogradRxSf2x3g1:0.759729,0,miopenConvolutionFwdAlgoWinograd;ConvBinWinogradRxSf3x2:0.764105,0,miopenConvolutionFwdAlgoWinograd;GemmFwdRest:0.597216,38448,miopenConvolutionFwdAlgoGEMM;ConvDirectNaiveConvFwd:2.03094,0,miopenConvolutionFwdAlgoDirect
659-1-3204-1x3-659-1-3204-17-0x1-1x1-1x1-0-NCHW-FP32-F=ConvBinWinogradRxSf2x3g1:23.7526,0,miopenConvolutionFwdAlgoWinograd;ConvBinWinogradRxSf3x2:31.0263,0,miopenConvolutionFwdAlgoWinograd;GemmFwdRest:18.6013,25337232,miopenConvolutionFwdAlgoGEMM;ConvDirectNaiveConvFwd:981.139,0,miopenConvolutionFwdAlgoDirect
659-1-1602-1x1-932-1-1602-17-0x0-1x1-1x1-0-NCHW-FP32-F=ConvBinWinogradRxSf2x3g1:16.7857,0,miopenConvolutionFwdAlgoWinograd;ConvBinWinogradRxSf3x2:11.3558,0,miopenConvolutionFwdAlgoWinograd;GemmFwd1x1_0_1:2.72574,0,miopenConvolutionFwdAlgoGEMM;ConvDirectNaiveConvFwd:266.983,0,miopenConvolutionFwdAlgoDirect
659-1-1602-1x3-932-1-1602-17-0x1-1x1-1x1-0-NCHW-FP32-F=ConvBinWinogradRxSf2x3g1:16.8615,0,miopenConvolutionFwdAlgoWinograd;ConvBinWinogradRxSf3x2:22.2024,0,miopenConvolutionFwdAlgoWinograd;GemmFwdRest:11.6196,12668616,miopenConvolutionFwdAlgoGEMM;ConvDirectNaiveConvFwd:693.005,0,miopenConvolutionFwdAlgoDirect
932-1-1602-1x3-932-1-1602-17-0x1-1x1-1x1-0-NCHW-FP32-F=ConvBinWinogradRxSf2x3g1:23.8393,0,miopenConvolutionFwdAlgoWinograd;ConvBinWinogradRxSf3x2:31.2637,0,miopenConvolutionFwdAlgoWinograd;GemmFwdRest:16.4276,17916768,miopenConvolutionFwdAlgoGEMM;ConvDirectNaiveConvFwd:978.57,0,miopenConvolutionFwdAlgoDirect
1-1-3204-1x1-862-1-3204-16-0x0-1x1-1x1-0-NCHW-FP32-F=ConvBinWinogradRxSf2x3g1:0.997291,0,miopenConvolutionFwdAlgoWinograd;ConvBinWinogradRxSf3x2:0.766168,0,miopenConvolutionFwdAlgoWinograd;GemmFwd1x1_0_1:0.505221,0,miopenConvolutionFwdAlgoGEMM;ConvDirectNaiveConvFwd:1.93351,0,miopenConvolutionFwdAlgoDirect
1-1-3204-1x3-862-1-3204-16-0x1-1x1-1x1-0-NCHW-FP32-F=ConvBinWinogradRxSf2x3g1:0.941834,0,miopenConvolutionFwdAlgoWinograd;ConvBinWinogradRxSf3x2:0.799256,0,miopenConvolutionFwdAlgoWinograd;GemmFwdRest:0.745759,38448,miopenConvolutionFwdAlgoGEMM;ConvDirectNaiveConvFwd:3.67148,0,miopenConvolutionFwdAlgoDirect
862-1-3204-1x3-862-1-3204-16-0x1-1x1-1x1-0-NCHW-FP32-F=ConvBinWinogradRxSf2x3g1:37.4773,0,miopenConvolutionFwdAlgoWinograd;ConvBinWinogradRxSf3x2:49.2044,0,miopenConvolutionFwdAlgoWinograd;GemmFwdRest:25.2472,33142176,miopenConvolutionFwdAlgoGEMM;ConvDirectNaiveConvFwd:1593.46,0,miopenConvolutionFwdAlgoDirect
862-1-3204-1x3-862-1-3204-16-0x1-1x1-1x1-0-NCHW-FP32-B=ConvBinWinogradRxSf2x3g1:37.7194,0,miopenConvolutionBwdDataAlgoWinograd;ConvBinWinogradRxSf3x2:49.0225,0,miopenConvolutionBwdDataAlgoWinograd;GemmBwdRest:20.3816,33142176,miopenConvolutionBwdDataAlgoGEMM;ConvDirectNaiveConvBwd:2308.7,0,miopenConvolutionBwdDataAlgoDirect
862-1-3204-1x3-862-1-3204-16-0x1-1x1-1x1-0-NCHW-FP32-W=ConvBinWinogradRxSf2x3g1:56.2127,0,miopenConvolutionBwdWeightsAlgoWinograd;ConvBinWinogradRxSf2x3:56.0536,0,miopenConvolutionBwdWeightsAlgoWinograd;ConvBinWinogradRxSf3x2:54.9193,0,miopenConvolutionBwdWeightsAlgoWinograd;GemmWrwUniversal:30.0616,33142176,miopenConvolutionBwdWeightsAlgoGEMM;ConvDirectNaiveConvWrw:1551.94,0,miopenConvolutionBwdWeightsAlgoDirect
862-1-3204-1x3-1-1-3204-16-0x1-1x1-1x1-0-NCHW-FP32-W=ConvBinWinogradRxSf2x3g1:2.01832,0,miopenConvolutionBwdWeightsAlgoWinograd;ConvBinWinogradRxSf2x3:2.03785,0,miopenConvolutionBwdWeightsAlgoWinograd;ConvBinWinogradRxSf3x2:3.40256,0,miopenConvolutionBwdWeightsAlgoWinograd;GemmWrwUniversal:2.90838,38448,miopenConvolutionBwdWeightsAlgoGEMM;ConvDirectNaiveConvWrw:76.7752,0,miopenConvolutionBwdWeightsAlgoDirect
862-1-3204-1x1-1-1-3204-16-0x0-1x1-1x1-0-NCHW-FP32-W=ConvBinWinogradRxSf2x3:2.02044,0,miopenConvolutionBwdWeightsAlgoWinograd;ConvBinWinogradRxSf3x2:2.81764,0,miopenConvolutionBwdWeightsAlgoWinograd;ConvBinWinogradRxSf2x3g1:1.98567,0,miopenConvolutionBwdWeightsAlgoWinograd;GemmWrw1x1_stride1:2.19137,0,miopenConvolutionBwdWeightsAlgoGEMM;ConvDirectNaiveConvWrw:77.7257,0,miopenConvolutionBwdWeightsAlgoDirect
1-1-3204-1x1-862-1-3204-10-0x0-1x1-1x1-0-NCHW-FP32-F=ConvBinWinogradRxSf2x3g1:0.59487,0,miopenConvolutionFwdAlgoWinograd;ConvBinWinogradRxSf3x2:0.597718,0,miopenConvolutionFwdAlgoWinograd;GemmFwd1x1_0_1:0.300387,0,miopenConvolutionFwdAlgoGEMM;ConvDirectNaiveConvFwd:0.856889,0,miopenConvolutionFwdAlgoDirect
1-1-3204-1x3-862-1-3204-10-0x1-1x1-1x1-0-NCHW-FP32-F=ConvBinWinogradRxSf2x3g1:0.594182,0,miopenConvolutionFwdAlgoWinograd;ConvBinWinogradRxSf3x2:0.527253,0,miopenConvolutionFwdAlgoWinograd;GemmFwdRest:0.474724,38448,miopenConvolutionFwdAlgoGEMM;ConvDirectNaiveConvFwd:2.32433,0,miopenConvolutionFwdAlgoDirect
862-1-3204-1x3-862-1-3204-10-0x1-1x1-1x1-0-NCHW-FP32-F=ConvBinWinogradRxSf2x3g1:23.4325,0,miopenConvolutionFwdAlgoWinograd;ConvBinWinogradRxSf3x2:30.3282,0,miopenConvolutionFwdAlgoWinograd;GemmFwdRest:15.7863,33142176,miopenConvolutionFwdAlgoGEMM;ConvDirectNaiveConvFwd:998.417,0,miopenConvolutionFwdAlgoDirect
862-1-3204-1x3-862-1-3204-10-0x1-1x1-1x1-0-NCHW-FP32-B=ConvBinWinogradRxSf2x3g1:23.3946,0,miopenConvolutionBwdDataAlgoWinograd;ConvBinWinogradRxSf3x2:30.6421,0,miopenConvolutionBwdDataAlgoWinograd;GemmBwdRest:12.9377,33142176,miopenConvolutionBwdDataAlgoGEMM;ConvDirectNaiveConvBwd:1449.3,0,miopenConvolutionBwdDataAlgoDirect
862-1-3204-1x3-862-1-3204-10-0x1-1x1-1x1-0-NCHW-FP32-W=ConvBinWinogradRxSf2x3g1:36.2386,0,miopenConvolutionBwdWeightsAlgoWinograd;ConvBinWinogradRxSf2x3:36.1139,0,miopenConvolutionBwdWeightsAlgoWinograd;ConvBinWinogradRxSf3x2:31.2431,0,miopenConvolutionBwdWeightsAlgoWinograd;GemmWrwUniversal:18.6683,33142176,miopenConvolutionBwdWeightsAlgoGEMM;ConvDirectNaiveConvWrw:964.716,0,miopenConvolutionBwdWeightsAlgoDirect
862-1-3204-1x3-1-1-3204-10-0x1-1x1-1x1-0-NCHW-FP32-W=ConvBinWinogradRxSf2x3g1:1.3828,0,miopenConvolutionBwdWeightsAlgoWinograd;ConvBinWinogradRxSf2x3:1.32489,0,miopenConvolutionBwdWeightsAlgoWinograd;ConvBinWinogradRxSf3x2:1.92608,0,miopenConvolutionBwdWeightsAlgoWinograd;GemmWrwUniversal:1.60392,38448,miopenConvolutionBwdWeightsAlgoGEMM;ConvDirectNaiveConvWrw:47.9232,0,miopenConvolutionBwdWeightsAlgoDirect
862-1-3204-1x1-1-1-3204-10-0x0-1x1-1x1-0-NCHW-FP32-W=ConvBinWinogradRxSf2x3:1.28611,0,miopenConvolutionBwdWeightsAlgoWinograd;ConvBinWinogradRxSf3x2:2.00402,0,miopenConvolutionBwdWeightsAlgoWinograd;ConvBinWinogradRxSf2x3g1:1.37597,0,miopenConvolutionBwdWeightsAlgoWinograd;GemmWrw1x1_stride1:1.52126,0,miopenConvolutionBwdWeightsAlgoGEMM;ConvDirectNaiveConvWrw:48.5312,0,miopenConvolutionBwdWeightsAlgoDirect
1-1-3204-1x1-862-1-3204-17-0x0-1x1-1x1-0-NCHW-FP32-F=ConvBinWinogradRxSf2x3g1:1.17591,0,miopenConvolutionFwdAlgoWinograd;ConvBinWinogradRxSf3x2:1.21954,0,miopenConvolutionFwdAlgoWinograd;GemmFwd1x1_0_1:0.716239,0,miopenConvolutionFwdAlgoGEMM;ConvDirectNaiveConvFwd:1.61309,0,miopenConvolutionFwdAlgoDirect
1-1-3204-1x3-862-1-3204-17-0x1-1x1-1x1-0-NCHW-FP32-F=ConvBinWinogradRxSf2x3g1:1.01773,0,miopenConvolutionFwdAlgoWinograd;ConvBinWinogradRxSf3x2:0.976986,0,miopenConvolutionFwdAlgoWinograd;GemmFwdRest:0.835689,38448,miopenConvolutionFwdAlgoGEMM;ConvDirectNaiveConvFwd:2.86761,0,miopenConvolutionFwdAlgoDirect
862-1-3204-1x3-862-1-3204-17-0x1-1x1-1x1-0-NCHW-FP32-F=ConvBinWinogradRxSf2x3g1:39.6043,0,miopenConvolutionFwdAlgoWinograd;ConvBinWinogradRxSf3x2:52.123,0,miopenConvolutionFwdAlgoWinograd;GemmFwdRest:26.8498,33142176,miopenConvolutionFwdAlgoGEMM;ConvDirectNaiveConvFwd:1686.52,0,miopenConvolutionFwdAlgoDirect
1-1-3204-1x1-254-1-3204-16-0x0-1x1-1x1-0-NCHW-FP32-F=ConvBinWinogradRxSf2x3g1:0.192874,0,miopenConvolutionFwdAlgoWinograd;ConvBinWinogradRxSf3x2:0.231514,0,miopenConvolutionFwdAlgoWinograd;GemmFwd1x1_0_1:0.125993,0,miopenConvolutionFwdAlgoGEMM;ConvDirectNaiveConvFwd:0.572838,0,miopenConvolutionFwdAlgoDirect
1-1-3204-1x3-254-1-3204-16-0x1-1x1-1x1-0-NCHW-FP32-F=ConvBinWinogradRxSf2x3g1:0.19057,0,miopenConvolutionFwdAlgoWinograd;ConvBinWinogradRxSf3x2:0.26365,0,miopenConvolutionFwdAlgoWinograd;GemmFwdRest:0.43046,38448,miopenConvolutionFwdAlgoGEMM;ConvDirectNaiveConvFwd:1.09105,0,miopenConvolutionFwdAlgoDirect
254-1-3204-1x3-254-1-3204-16-0x1-1x1-1x1-0-NCHW-FP32-F=ConvBinWinogradRxSf2x3g1:3.30953,0,miopenConvolutionFwdAlgoWinograd;ConvBinWinogradRxSf3x2:4.38496,0,miopenConvolutionFwdAlgoWinograd;GemmFwdRest:4.09394,9765792,miopenConvolutionFwdAlgoGEMM;ConvDirectNaiveConvFwd:145.523,0,miopenConvolutionFwdAlgoDirect
254-1-3204-1x3-254-1-3204-16-0x1-1x1-1x1-0-NCHW-FP32-B=ConvBinWinogradRxSf2x3g1:3.30164,0,miopenConvolutionBwdDataAlgoWinograd;ConvBinWinogradRxSf3x2:4.37223,0,miopenConvolutionBwdDataAlgoWinograd;GemmBwdRest:2.35649,9765792,miopenConvolutionBwdDataAlgoGEMM;ConvDirectNaiveConvBwd:205.038,0,miopenConvolutionBwdDataAlgoDirect
254-1-3204-1x3-254-1-3204-16-0x1-1x1-1x1-0-NCHW-FP32-W=ConvBinWinogradRxSf2x3g1:6.04299,0,miopenConvolutionBwdWeightsAlgoWinograd;ConvBinWinogradRxSf2x3:6.03066,0,miopenConvolutionBwdWeightsAlgoWinograd;ConvBinWinogradRxSf3x2:5.93691,0,miopenConvolutionBwdWeightsAlgoWinograd;GemmWrwUniversal:7.04326,9765792,miopenConvolutionBwdWeightsAlgoGEMM;ConvDirectNaiveConvWrw:152.645,0,miopenConvolutionBwdWeightsAlgoDirect
254-1-3204-1x3-1-1-3204-16-0x1-1x1-1x1-0-NCHW-FP32-W=ConvBinWinogradRxSf2x3g1:2.09301,0,miopenConvolutionBwdWeightsAlgoWinograd;ConvBinWinogradRxSf2x3:2.03482,0,miopenConvolutionBwdWeightsAlgoWinograd;ConvBinWinogradRxSf3x2:2.88456,0,miopenConvolutionBwdWeightsAlgoWinograd;GemmWrwUniversal:2.27691,38448,miopenConvolutionBwdWeightsAlgoGEMM;ConvDirectNaiveConvWrw:31.5432,0,miopenConvolutionBwdWeightsAlgoDirect
254-1-3204-1x1-1-1-3204-16-0x0-1x1-1x1-0-NCHW-FP32-W=ConvBinWinogradRxSf2x3:2.01192,0,miopenConvolutionBwdWeightsAlgoWinograd;ConvBinWinogradRxSf3x2:2.82601,0,miopenConvolutionBwdWeightsAlgoWinograd;ConvBinWinogradRxSf2x3g1:2.03169,0,miopenConvolutionBwdWeightsAlgoWinograd;GemmWrw1x1_stride1:2.15491,0,miopenConvolutionBwdWeightsAlgoGEMM;ConvDirectNaiveConvWrw:31.7764,0,miopenConvolutionBwdWeightsAlgoDirect
1-1-3204-1x1-254-1-3204-10-0x0-1x1-1x1-0-NCHW-FP32-F=ConvBinWinogradRxSf2x3g1:0.0949368,0,miopenConvolutionFwdAlgoWinograd;ConvBinWinogradRxSf3x2:0.118809,0,miopenConvolutionFwdAlgoWinograd;GemmFwd1x1_0_1:0.0706646,0,miopenConvolutionFwdAlgoGEMM;ConvDirectNaiveConvFwd:0.291787,0,miopenConvolutionFwdAlgoDirect
1-1-3204-1x3-254-1-3204-10-0x1-1x1-1x1-0-NCHW-FP32-F=ConvBinWinogradRxSf2x3g1:0.124889,0,miopenConvolutionFwdAlgoWinograd;ConvBinWinogradRxSf3x2:0.166666,0,miopenConvolutionFwdAlgoWinograd;GemmFwdRest:0.258874,38448,miopenConvolutionFwdAlgoGEMM;ConvDirectNaiveConvFwd:0.693815,0,miopenConvolutionFwdAlgoDirect
254-1-3204-1x3-254-1-3204-10-0x1-1x1-1x1-0-NCHW-FP32-F=ConvBinWinogradRxSf2x3g1:2.08407,0,miopenConvolutionFwdAlgoWinograd;ConvBinWinogradRxSf3x2:2.71783,0,miopenConvolutionFwdAlgoWinograd;GemmFwdRest:2.48522,9765792,miopenConvolutionFwdAlgoGEMM;ConvDirectNaiveConvFwd:92.017,0,miopenConvolutionFwdAlgoDirect
254-1-3204-1x3-254-1-3204-10-0x1-1x1-1x1-0-NCHW-FP32-B=ConvBinWinogradRxSf2x3g1:2.08307,0,miopenConvolutionBwdDataAlgoWinograd;ConvBinWinogradRxSf3x2:2.7177,0,miopenConvolutionBwdDataAlgoWinograd;GemmBwdRest:1.44281,9765792,miopenConvolutionBwdDataAlgoGEMM;ConvDirectNaiveConvBwd:130.265,0,miopenConvolutionBwdDataAlgoDirect
254-1-3204-1x3-254-1-3204-10-0x1-1x1-1x1-0-NCHW-FP32-W=ConvBinWinogradRxSf2x3g1:3.94712,0,miopenConvolutionBwdWeightsAlgoWinograd;ConvBinWinogradRxSf2x3:3.94607,0,miopenConvolutionBwdWeightsAlgoWinograd;ConvBinWinogradRxSf3x2:3.85123,0,miopenConvolutionBwdWeightsAlgoWinograd;GemmWrwUniversal:4.28186,9765792,miopenConvolutionBwdWeightsAlgoGEMM;ConvDirectNaiveConvWrw:97.6594,0,miopenConvolutionBwdWeightsAlgoDirect
254-1-3204-1x3-1-1-3204-10-0x1-1x1-1x1-0-NCHW-FP32-W=ConvBinWinogradRxSf2x3g1:1.32582,0,miopenConvolutionBwdWeightsAlgoWinograd;ConvBinWinogradRxSf2x3:1.35345,0,miopenConvolutionBwdWeightsAlgoWinograd;ConvBinWinogradRxSf3x2:1.80582,0,miopenConvolutionBwdWeightsAlgoWinograd;GemmWrwUniversal:1.18685,38448,miopenConvolutionBwdWeightsAlgoGEMM;ConvDirectNaiveConvWrw:19.8202,0,miopenConvolutionBwdWeightsAlgoDirect
254-1-3204-1x1-1-1-3204-10-0x0-1x1-1x1-0-NCHW-FP32-W=ConvBinWinogradRxSf2x3:1.33884,0,miopenConvolutionBwdWeightsAlgoWinograd;ConvBinWinogradRxSf3x2:1.81306,0,miopenConvolutionBwdWeightsAlgoWinograd;ConvBinWinogradRxSf2x3g1:1.31774,0,miopenConvolutionBwdWeightsAlgoWinograd;GemmWrw1x1_stride1:1.0857,0,miopenConvolutionBwdWeightsAlgoGEMM;ConvDirectNaiveConvWrw:19.8679,0,miopenConvolutionBwdWeightsAlgoDirect
1-1-3204-1x1-254-1-3204-17-0x0-1x1-1x1-0-NCHW-FP32-F=ConvBinWinogradRxSf2x3g1:0.185586,0,miopenConvolutionFwdAlgoWinograd;ConvBinWinogradRxSf3x2:0.179882,0,miopenConvolutionFwdAlgoWinograd;GemmFwd1x1_0_1:0.162922,0,miopenConvolutionFwdAlgoGEMM;ConvDirectNaiveConvFwd:0.426852,0,miopenConvolutionFwdAlgoDirect
1-1-3204-1x3-254-1-3204-17-0x1-1x1-1x1-0-NCHW-FP32-F=ConvBinWinogradRxSf2x3g1:0.194186,0,miopenConvolutionFwdAlgoWinograd;ConvBinWinogradRxSf3x2:0.190634,0,miopenConvolutionFwdAlgoWinograd;GemmFwdRest:0.397044,38448,miopenConvolutionFwdAlgoGEMM;ConvDirectNaiveConvFwd:0.80588,0,miopenConvolutionFwdAlgoDirect
254-1-3204-1x3-254-1-3204-17-0x1-1x1-1x1-0-NCHW-FP32-F=ConvBinWinogradRxSf2x3g1:3.54523,0,miopenConvolutionFwdAlgoWinograd;ConvBinWinogradRxSf3x2:4.73145,0,miopenConvolutionFwdAlgoWinograd;GemmFwdRest:4.25735,9765792,miopenConvolutionFwdAlgoGEMM;ConvDirectNaiveConvFwd:153.559,0,miopenConvolutionFwdAlgoDirect
1-1-3204-1x1-189-1-3204-16-0x0-1x1-1x1-0-NCHW-FP32-F=ConvBinWinogradRxSf2x3g1:0.151169,0,miopenConvolutionFwdAlgoWinograd;ConvBinWinogradRxSf3x2:0.181466,0,miopenConvolutionFwdAlgoWinograd;GemmFwd1x1_0_1:0.124673,0,miopenConvolutionFwdAlgoGEMM;ConvDirectNaiveConvFwd:0.432484,0,miopenConvolutionFwdAlgoDirect
1-1-3204-1x3-189-1-3204-16-0x1-1x1-1x1-0-NCHW-FP32-F=ConvBinWinogradRxSf2x3g1:0.149145,0,miopenConvolutionFwdAlgoWinograd;ConvBinWinogradRxSf3x2:0.200418,0,miopenConvolutionFwdAlgoWinograd;GemmFwdRest:0.506772,38448,miopenConvolutionFwdAlgoGEMM;ConvDirectNaiveConvFwd:0.820544,0,miopenConvolutionFwdAlgoDirect
189-1-3204-1x3-189-1-3204-16-0x1-1x1-1x1-0-NCHW-FP32-F=ConvBinWinogradRxSf2x3g1:1.82784,0,miopenConvolutionFwdAlgoWinograd;ConvBinWinogradRxSf3x2:2.43382,0,miopenConvolutionFwdAlgoWinograd;GemmFwdRest:3.62626,7266672,miopenConvolutionFwdAlgoGEMM;ConvDirectNaiveConvFwd:80.7296,0,miopenConvolutionFwdAlgoDirect
189-1-3204-1x3-189-1-3204-16-0x1-1x1-1x1-0-NCHW-FP32-B=ConvBinWinogradRxSf2x3g1:1.84855,0,miopenConvolutionBwdDataAlgoWinograd;ConvBinWinogradRxSf3x2:2.47556,0,miopenConvolutionBwdDataAlgoWinograd;GemmBwdRest:1.51967,7266672,miopenConvolutionBwdDataAlgoGEMM;ConvDirectNaiveConvBwd:114.275,0,miopenConvolutionBwdDataAlgoDirect
189-1-3204-1x3-189-1-3204-16-0x1-1x1-1x1-0-NCHW-FP32-W=ConvBinWinogradRxSf2x3g1:3.99721,0,miopenConvolutionBwdWeightsAlgoWinograd;ConvBinWinogradRxSf2x3:4.03078,0,miopenConvolutionBwdWeightsAlgoWinograd;ConvBinWinogradRxSf3x2:3.00532,0,miopenConvolutionBwdWeightsAlgoWinograd;GemmWrwUniversal:5.98316,7266672,miopenConvolutionBwdWeightsAlgoGEMM;ConvDirectNaiveConvWrw:96.7667,0,miopenConvolutionBwdWeightsAlgoDirect
189-1-3204-1x3-1-1-3204-16-0x1-1x1-1x1-0-NCHW-FP32-W=ConvBinWinogradRxSf2x3g1:2.01589,0,miopenConvolutionBwdWeightsAlgoWinograd;ConvBinWinogradRxSf2x3:2.01218,0,miopenConvolutionBwdWeightsAlgoWinograd;ConvBinWinogradRxSf3x2:2.83724,0,miopenConvolutionBwdWeightsAlgoWinograd;GemmWrwUniversal:2.08236,38448,miopenConvolutionBwdWeightsAlgoGEMM;ConvDirectNaiveConvWrw:18.3434,0,miopenConvolutionBwdWeightsAlgoDirect
189-1-3204-1x1-1-1-3204-16-0x0-1x1-1x1-0-NCHW-FP32-W=ConvBinWinogradRxSf2x3:2.00511,0,miopenConvolutionBwdWeightsAlgoWinograd;ConvBinWinogradRxSf3x2:2.81155,0,miopenConvolutionBwdWeightsAlgoWinograd;ConvBinWinogradRxSf2x3g1:2.00003,0,miopenConvolutionBwdWeightsAlgoWinograd;GemmWrw1x1_stride1:1.86563,0,miopenConvolutionBwdWeightsAlgoGEMM;ConvDirectNaiveConvWrw:21.7959,0,miopenConvolutionBwdWeightsAlgoDirect
1-1-3204-1x1-189-1-3204-10-0x0-1x1-1x1-0-NCHW-FP32-F=ConvBinWinogradRxSf2x3g1:0.0739928,0,miopenConvolutionFwdAlgoWinograd;ConvBinWinogradRxSf3x2:0.0940886,0,miopenConvolutionFwdAlgoWinograd;GemmFwd1x1_0_1:0.0732406,0,miopenConvolutionFwdAlgoGEMM;ConvDirectNaiveConvFwd:0.210018,0,miopenConvolutionFwdAlgoDirect
1-1-3204-1x3-189-1-3204-10-0x1-1x1-1x1-0-NCHW-FP32-F=ConvBinWinogradRxSf2x3g1:0.103185,0,miopenConvolutionFwdAlgoWinograd;ConvBinWinogradRxSf3x2:0.132569,0,miopenConvolutionFwdAlgoWinograd;GemmFwdRest:0.317779,38448,miopenConvolutionFwdAlgoGEMM;ConvDirectNaiveConvFwd:0.517229,0,miopenConvolutionFwdAlgoDirect
189-1-3204-1x3-189-1-3204-10-0x1-1x1-1x1-0-NCHW-FP32-F=ConvBinWinogradRxSf2x3g1:1.11263,0,miopenConvolutionFwdAlgoWinograd;ConvBinWinogradRxSf3x2:1.51866,0,miopenConvolutionFwdAlgoWinograd;GemmFwdRest:2.26483,7266672,miopenConvolutionFwdAlgoGEMM;ConvDirectNaiveConvFwd:50.8721,0,miopenConvolutionFwdAlgoDirect
189-1-3204-1x3-189-1-3204-10-0x1-1x1-1x1-0-NCHW-FP32-B=ConvBinWinogradRxSf2x3g1:1.14791,0,miopenConvolutionBwdDataAlgoWinograd;ConvBinWinogradRxSf3x2:1.58893,0,miopenConvolutionBwdDataAlgoWinograd;GemmBwdRest:1.11192,7266672,miopenConvolutionBwdDataAlgoGEMM;ConvDirectNaiveConvBwd:72.4186,0,miopenConvolutionBwdDataAlgoDirect
189-1-3204-1x3-189-1-3204-10-0x1-1x1-1x1-0-NCHW-FP32-W=ConvBinWinogradRxSf2x3g1:2.66334,0,miopenConvolutionBwdWeightsAlgoWinograd;ConvBinWinogradRxSf2x3:2.57795,0,miopenConvolutionBwdWeightsAlgoWinograd;ConvBinWinogradRxSf3x2:1.94375,0,miopenConvolutionBwdWeightsAlgoWinograd;GemmWrwUniversal:3.34164,7266672,miopenConvolutionBwdWeightsAlgoGEMM;ConvDirectNaiveConvWrw:58.7688,0,miopenConvolutionBwdWeightsAlgoDirect
189-1-3204-1x3-1-1-3204-10-0x1-1x1-1x1-0-NCHW-FP32-W=ConvBinWinogradRxSf2x3g1:1.3822,0,miopenConvolutionBwdWeightsAlgoWinograd;ConvBinWinogradRxSf2x3:1.39595,0,miopenConvolutionBwdWeightsAlgoWinograd;ConvBinWinogradRxSf3x2:1.80371,0,miopenConvolutionBwdWeightsAlgoWinograd;GemmWrwUniversal:1.38149,38448,miopenConvolutionBwdWeightsAlgoGEMM;ConvDirectNaiveConvWrw:11.8362,0,miopenConvolutionBwdWeightsAlgoDirect
189-1-3204-1x1-1-1-3204-10-0x0-1x1-1x1-0-NCHW-FP32-W=ConvBinWinogradRxSf2x3:1.40474,0,miopenConvolutionBwdWeightsAlgoWinograd;ConvBinWinogradRxSf3x2:1.85463,0,miopenConvolutionBwdWeightsAlgoWinograd;ConvBinWinogradRxSf2x3g1:1.35873,0,miopenConvolutionBwdWeightsAlgoWinograd;GemmWrw1x1_stride1:1.17202,0,miopenConvolutionBwdWeightsAlgoGEMM;ConvDirectNaiveConvWrw:11.8208,0,miopenConvolutionBwdWeightsAlgoDirect
1-1-3204-1x1-189-1-3204-17-0x0-1x1-1x1-0-NCHW-FP32-F=ConvBinWinogradRxSf2x3g1:0.108953,0,miopenConvolutionFwdAlgoWinograd;ConvBinWinogradRxSf3x2:0.131801,0,miopenConvolutionFwdAlgoWinograd;GemmFwd1x1_0_1:0.217234,0,miopenConvolutionFwdAlgoGEMM;ConvDirectNaiveConvFwd:0.319555,0,miopenConvolutionFwdAlgoDirect
1-1-3204-1x3-189-1-3204-17-0x1-1x1-1x1-0-NCHW-FP32-F=ConvBinWinogradRxSf2x3g1:0.132537,0,miopenConvolutionFwdAlgoWinograd;ConvBinWinogradRxSf3x2:0.149305,0,miopenConvolutionFwdAlgoWinograd;GemmFwdRest:0.428916,38448,miopenConvolutionFwdAlgoGEMM;ConvDirectNaiveConvFwd:0.615694,0,miopenConvolutionFwdAlgoDirect
189-1-3204-1x3-189-1-3204-17-0x1-1x1-1x1-0-NCHW-FP32-F=ConvBinWinogradRxSf2x3g1:2.0282,0,miopenConvolutionFwdAlgoWinograd;ConvBinWinogradRxSf3x2:2.61329,0,miopenConvolutionFwdAlgoWinograd;GemmFwdRest:3.81853,7266672,miopenConvolutionFwdAlgoGEMM;ConvDirectNaiveConvFwd:85.7653,0,miopenConvolutionFwdAlgoDirect
1-1-3204-1x1-578-1-3204-16-0x0-1x1-1x1-0-NCHW-FP32-F=ConvBinWinogradRxSf2x3g1:0.642518,0,miopenConvolutionFwdAlgoWinograd;ConvBinWinogradRxSf3x2:0.543653,0,miopenConvolutionFwdAlgoWinograd;GemmFwd1x1_0_1:0.437876,0,miopenConvolutionFwdAlgoGEMM;ConvDirectNaiveConvFwd:1.30116,0,miopenConvolutionFwdAlgoDirect
1-1-3204-1x3-578-1-3204-16-0x1-1x1-1x1-0-NCHW-FP32-F=ConvBinWinogradRxSf2x3g1:0.62691,0,miopenConvolutionFwdAlgoWinograd;ConvBinWinogradRxSf3x2:0.596637,0,miopenConvolutionFwdAlgoWinograd;GemmFwdRest:0.690767,38448,miopenConvolutionFwdAlgoGEMM;ConvDirectNaiveConvFwd:2.47693,0,miopenConvolutionFwdAlgoDirect
578-1-3204-1x3-578-1-3204-16-0x1-1x1-1x1-0-NCHW-FP32-F=ConvBinWinogradRxSf2x3g1:17.8274,0,miopenConvolutionFwdAlgoWinograd;ConvBinWinogradRxSf3x2:22.9095,0,miopenConvolutionFwdAlgoWinograd;GemmFwdRest:13.8583,22222944,miopenConvolutionFwdAlgoGEMM;ConvDirectNaiveConvFwd:719.259,0,miopenConvolutionFwdAlgoDirect
578-1-1602-1x3-578-1-1602-16-0x1-1x1-1x1-0-NCHW-FP32-F=ConvBinWinogradRxSf2x3g1:9.10535,0,miopenConvolutionFwdAlgoWinograd;ConvBinWinogradRxSf3x2:11.3355,0,miopenConvolutionFwdAlgoWinograd;GemmFwdRest:11.3875,11111472,miopenConvolutionFwdAlgoGEMM;ConvDirectNaiveConvFwd:356.357,0,miopenConvolutionFwdAlgoDirect
578-1-801-1x3-578-1-801-16-0x1-1x1-1x1-0-NCHW-FP32-F=ConvBinWinogradRxSf2x3g1:4.32666,0,miopenConvolutionFwdAlgoWinograd;ConvBinWinogradRxSf3x2:5.78423,0,miopenConvolutionFwdAlgoWinograd;GemmFwdRest:4.45291,5555736,miopenConvolutionFwdAlgoGEMM;ConvDirectNaiveConvFwd:192.968,0,miopenConvolutionFwdAlgoDirect
578-1-801-1x3-578-1-801-16-0x1-1x1-1x1-0-NCHW-FP32-B=ConvBinWinogradRxSf2x3g1:4.51775,0,miopenConvolutionBwdDataAlgoWinograd;ConvBinWinogradRxSf3x2:5.7274,0,miopenConvolutionBwdDataAlgoWinograd;GemmBwdRest:2.71594,5555736,miopenConvolutionBwdDataAlgoGEMM;ConvDirectNaiveConvBwd:274.43,0,miopenConvolutionBwdDataAlgoDirect
578-1-801-1x3-578-1-801-16-0x1-1x1-1x1-0-NCHW-FP32-W=ConvBinWinogradRxSf2x3g1:7.28242,0,miopenConvolutionBwdWeightsAlgoWinograd;ConvBinWinogradRxSf2x3:7.11396,0,miopenConvolutionBwdWeightsAlgoWinograd;ConvBinWinogradRxSf3x2:5.48268,0,miopenConvolutionBwdWeightsAlgoWinograd;GemmWrwUniversal:4.16504,5555736,miopenConvolutionBwdWeightsAlgoGEMM;ConvDirectNaiveConvWrw:186.33,0,miopenConvolutionBwdWeightsAlgoDirect
578-1-1602-1x3-578-1-1602-16-0x1-1x1-1x1-0-NCHW-FP32-B=ConvBinWinogradRxSf2x3g1:9.06599,0,miopenConvolutionBwdDataAlgoWinograd;ConvBinWinogradRxSf3x2:11.7175,0,miopenConvolutionBwdDataAlgoWinograd;GemmBwdRest:4.9679,11111472,miopenConvolutionBwdDataAlgoGEMM;ConvDirectNaiveConvBwd:516.923,0,miopenConvolutionBwdDataAlgoDirect
578-1-1602-1x3-578-1-1602-16-0x1-1x1-1x1-0-NCHW-FP32-W=ConvBinWinogradRxSf2x3g1:15.8746,0,miopenConvolutionBwdWeightsAlgoWinograd;ConvBinWinogradRxSf2x3:15.46,0,miopenConvolutionBwdWeightsAlgoWinograd;ConvBinWinogradRxSf3x2:10.6133,0,miopenConvolutionBwdWeightsAlgoWinograd;GemmWrwUniversal:7.79615,11111472,miopenConvolutionBwdWeightsAlgoGEMM;ConvDirectNaiveConvWrw:364.671,0,miopenConvolutionBwdWeightsAlgoDirect
578-1-3204-1x3-578-1-3204-16-0x1-1x1-1x1-0-NCHW-FP32-B=ConvBinWinogradRxSf2x3g1:17.7004,0,miopenConvolutionBwdDataAlgoWinograd;ConvBinWinogradRxSf3x2:23.227,0,miopenConvolutionBwdDataAlgoWinograd;GemmBwdRest:9.80675,22222944,miopenConvolutionBwdDataAlgoGEMM;ConvDirectNaiveConvBwd:1040.06,0,miopenConvolutionBwdDataAlgoDirect
578-1-3204-1x3-578-1-3204-16-0x1-1x1-1x1-0-NCHW-FP32-W=ConvBinWinogradRxSf2x3g1:31.7958,0,miopenConvolutionBwdWeightsAlgoWinograd;ConvBinWinogradRxSf2x3:31.6567,0,miopenConvolutionBwdWeightsAlgoWinograd;ConvBinWinogradRxSf3x2:23.8051,0,miopenConvolutionBwdWeightsAlgoWinograd;GemmWrwUniversal:17.0986,22222944,miopenConvolutionBwdWeightsAlgoGEMM;ConvDirectNaiveConvWrw:722.312,0,miopenConvolutionBwdWeightsAlgoDirect
578-1-3204-1x3-1-1-3204-16-0x1-1x1-1x1-0-NCHW-FP32-W=ConvBinWinogradRxSf2x3g1:2.008,0,miopenConvolutionBwdWeightsAlgoWinograd;ConvBinWinogradRxSf2x3:2.03997,0,miopenConvolutionBwdWeightsAlgoWinograd;ConvBinWinogradRxSf3x2:2.90183,0,miopenConvolutionBwdWeightsAlgoWinograd;GemmWrwUniversal:2.27863,38448,miopenConvolutionBwdWeightsAlgoGEMM;ConvDirectNaiveConvWrw:51.4493,0,miopenConvolutionBwdWeightsAlgoDirect
578-1-3204-1x1-1-1-3204-16-0x0-1x1-1x1-0-NCHW-FP32-W=ConvBinWinogradRxSf2x3:2.01101,0,miopenConvolutionBwdWeightsAlgoWinograd;ConvBinWinogradRxSf3x2:2.88219,0,miopenConvolutionBwdWeightsAlgoWinograd;ConvBinWinogradRxSf2x3g1:2.01247,0,miopenConvolutionBwdWeightsAlgoWinograd;GemmWrw1x1_stride1:2.16741,0,miopenConvolutionBwdWeightsAlgoGEMM;ConvDirectNaiveConvWrw:52.9019,0,miopenConvolutionBwdWeightsAlgoDirect
1-1-3204-1x1-578-1-3204-10-0x0-1x1-1x1-0-NCHW-FP32-F=ConvBinWinogradRxSf2x3g1:0.359163,0,miopenConvolutionFwdAlgoWinograd;ConvBinWinogradRxSf3x2:0.379603,0,miopenConvolutionFwdAlgoWinograd;GemmFwd1x1_0_1:0.270727,0,miopenConvolutionFwdAlgoGEMM;ConvDirectNaiveConvFwd:0.59991,0,miopenConvolutionFwdAlgoDirect
1-1-3204-1x3-578-1-3204-10-0x1-1x1-1x1-0-NCHW-FP32-F=ConvBinWinogradRxSf2x3g1:0.338443,0,miopenConvolutionFwdAlgoWinograd;ConvBinWinogradRxSf3x2:0.37234,0,miopenConvolutionFwdAlgoWinograd;GemmFwdRest:0.445661,38448,miopenConvolutionFwdAlgoGEMM;ConvDirectNaiveConvFwd:1.63088,0,miopenConvolutionFwdAlgoDirect
578-1-3204-1x3-578-1-3204-10-0x1-1x1-1x1-0-NCHW-FP32-F=ConvBinWinogradRxSf2x3g1:10.8719,0,miopenConvolutionFwdAlgoWinograd;ConvBinWinogradRxSf3x2:14.4066,0,miopenConvolutionFwdAlgoWinograd;GemmFwdRest:8.75816,22222944,miopenConvolutionFwdAlgoGEMM;ConvDirectNaiveConvFwd:459.799,0,miopenConvolutionFwdAlgoDirect
578-1-1602-1x3-578-1-1602-10-0x1-1x1-1x1-0-NCHW-FP32-F=ConvBinWinogradRxSf2x3g1:5.40592,0,miopenConvolutionFwdAlgoWinograd;ConvBinWinogradRxSf3x2:7.05772,0,miopenConvolutionFwdAlgoWinograd;GemmFwdRest:7.2181,11111472,miopenConvolutionFwdAlgoGEMM;ConvDirectNaiveConvFwd:226.054,0,miopenConvolutionFwdAlgoDirect
578-1-801-1x3-578-1-801-10-0x1-1x1-1x1-0-NCHW-FP32-F=ConvBinWinogradRxSf2x3g1:2.7234,0,miopenConvolutionFwdAlgoWinograd;ConvBinWinogradRxSf3x2:3.7285,0,miopenConvolutionFwdAlgoWinograd;GemmFwdRest:2.76716,5555736,miopenConvolutionFwdAlgoGEMM;ConvDirectNaiveConvFwd:121.542,0,miopenConvolutionFwdAlgoDirect
578-1-801-1x3-578-1-801-10-0x1-1x1-1x1-0-NCHW-FP32-B=ConvBinWinogradRxSf2x3g1:2.7335,0,miopenConvolutionBwdDataAlgoWinograd;ConvBinWinogradRxSf3x2:3.55977,0,miopenConvolutionBwdDataAlgoWinograd;GemmBwdRest:1.85074,5555736,miopenConvolutionBwdDataAlgoGEMM;ConvDirectNaiveConvBwd:175.335,0,miopenConvolutionBwdDataAlgoDirect
578-1-801-1x3-578-1-801-10-0x1-1x1-1x1-0-NCHW-FP32-W=ConvBinWinogradRxSf2x3g1:4.70516,0,miopenConvolutionBwdWeightsAlgoWinograd;ConvBinWinogradRxSf2x3:4.68495,0,miopenConvolutionBwdWeightsAlgoWinograd;ConvBinWinogradRxSf3x2:3.44882,0,miopenConvolutionBwdWeightsAlgoWinograd;GemmWrwUniversal:2.86586,5555736,miopenConvolutionBwdWeightsAlgoGEMM;ConvDirectNaiveConvWrw:116.939,0,miopenConvolutionBwdWeightsAlgoDirect
578-1-1602-1x3-578-1-1602-10-0x1-1x1-1x1-0-NCHW-FP32-B=ConvBinWinogradRxSf2x3g1:5.69524,0,miopenConvolutionBwdDataAlgoWinograd;ConvBinWinogradRxSf3x2:7.25435,0,miopenConvolutionBwdDataAlgoWinograd;GemmBwdRest:3.11097,11111472,miopenConvolutionBwdDataAlgoGEMM;ConvDirectNaiveConvBwd:324.519,0,miopenConvolutionBwdDataAlgoDirect
578-1-1602-1x3-578-1-1602-10-0x1-1x1-1x1-0-NCHW-FP32-W=ConvBinWinogradRxSf2x3g1:9.89882,0,miopenConvolutionBwdWeightsAlgoWinograd;ConvBinWinogradRxSf2x3:9.2641,0,miopenConvolutionBwdWeightsAlgoWinograd;ConvBinWinogradRxSf3x2:6.91128,0,miopenConvolutionBwdWeightsAlgoWinograd;GemmWrwUniversal:4.76095,11111472,miopenConvolutionBwdWeightsAlgoGEMM;ConvDirectNaiveConvWrw:229.762,0,miopenConvolutionBwdWeightsAlgoDirect
578-1-3204-1x3-578-1-3204-10-0x1-1x1-1x1-0-NCHW-FP32-B=ConvBinWinogradRxSf2x3g1:11.0404,0,miopenConvolutionBwdDataAlgoWinograd;ConvBinWinogradRxSf3x2:14.6471,0,miopenConvolutionBwdDataAlgoWinograd;GemmBwdRest:6.20795,22222944,miopenConvolutionBwdDataAlgoGEMM;ConvDirectNaiveConvBwd:654.887,0,miopenConvolutionBwdDataAlgoDirect
578-1-3204-1x3-578-1-3204-10-0x1-1x1-1x1-0-NCHW-FP32-W=ConvBinWinogradRxSf2x3g1:19.9564,0,miopenConvolutionBwdWeightsAlgoWinograd;ConvBinWinogradRxSf2x3:20.138,0,miopenConvolutionBwdWeightsAlgoWinograd;ConvBinWinogradRxSf3x2:13.7669,0,miopenConvolutionBwdWeightsAlgoWinograd;GemmWrwUniversal:10.6803,22222944,miopenConvolutionBwdWeightsAlgoGEMM;ConvDirectNaiveConvWrw:451.312,0,miopenConvolutionBwdWeightsAlgoDirect
578-1-3204-1x3-1-1-3204-10-0x1-1x1-1x1-0-NCHW-FP32-W=ConvBinWinogradRxSf2x3g1:1.32539,0,miopenConvolutionBwdWeightsAlgoWinograd;ConvBinWinogradRxSf2x3:1.26883,0,miopenConvolutionBwdWeightsAlgoWinograd;ConvBinWinogradRxSf3x2:1.89983,0,miopenConvolutionBwdWeightsAlgoWinograd;GemmWrwUniversal:1.42695,38448,miopenConvolutionBwdWeightsAlgoGEMM;ConvDirectNaiveConvWrw:32.0627,0,miopenConvolutionBwdWeightsAlgoDirect
578-1-3204-1x1-1-1-3204-10-0x0-1x1-1x1-0-NCHW-FP32-W=ConvBinWinogradRxSf2x3:1.24083,0,miopenConvolutionBwdWeightsAlgoWinograd;ConvBinWinogradRxSf3x2:1.91398,0,miopenConvolutionBwdWeightsAlgoWinograd;ConvBinWinogradRxSf2x3g1:1.34028,0,miopenConvolutionBwdWeightsAlgoWinograd;GemmWrw1x1_stride1:1.35023,0,miopenConvolutionBwdWeightsAlgoGEMM;ConvDirectNaiveConvWrw:32.7641,0,miopenConvolutionBwdWeightsAlgoDirect
1-1-3204-1x1-578-1-3204-17-0x0-1x1-1x1-0-NCHW-FP32-F=ConvBinWinogradRxSf2x3g1:0.67135,0,miopenConvolutionFwdAlgoWinograd;ConvBinWinogradRxSf3x2:0.654126,0,miopenConvolutionFwdAlgoWinograd;GemmFwd1x1_0_1:0.439092,0,miopenConvolutionFwdAlgoGEMM;ConvDirectNaiveConvFwd:0.951345,0,miopenConvolutionFwdAlgoDirect
1-1-3204-1x3-578-1-3204-17-0x1-1x1-1x1-0-NCHW-FP32-F=ConvBinWinogradRxSf2x3g1:0.66975,0,miopenConvolutionFwdAlgoWinograd;ConvBinWinogradRxSf3x2:0.672742,0,miopenConvolutionFwdAlgoWinograd;GemmFwdRest:0.634134,38448,miopenConvolutionFwdAlgoGEMM;ConvDirectNaiveConvFwd:1.79659,0,miopenConvolutionFwdAlgoDirect
578-1-3204-1x3-578-1-3204-17-0x1-1x1-1x1-0-NCHW-FP32-F=ConvBinWinogradRxSf2x3g1:18.8413,0,miopenConvolutionFwdAlgoWinograd;ConvBinWinogradRxSf3x2:24.3861,0,miopenConvolutionFwdAlgoWinograd;GemmFwdRest:14.6791,22222944,miopenConvolutionFwdAlgoGEMM;ConvDirectNaiveConvFwd:759.641,0,miopenConvolutionFwdAlgoDirect
578-1-1602-1x3-578-1-1602-17-0x1-1x1-1x1-0-NCHW-FP32-F=ConvBinWinogradRxSf2x3g1:9.46242,0,miopenConvolutionFwdAlgoWinograd;ConvBinWinogradRxSf3x2:12.3048,0,miopenConvolutionFwdAlgoWinograd;GemmFwdRest:11.9118,11111472,miopenConvolutionFwdAlgoGEMM;ConvDirectNaiveConvFwd:379.296,0,miopenConvolutionFwdAlgoDirect
578-1-801-1x3-578-1-801-17-0x1-1x1-1x1-0-NCHW-FP32-F=ConvBinWinogradRxSf2x3g1:4.60468,0,miopenConvolutionFwdAlgoWinograd;ConvBinWinogradRxSf3x2:6.0417,0,miopenConvolutionFwdAlgoWinograd;GemmFwdRest:4.77984,5555736,miopenConvolutionFwdAlgoGEMM;ConvDirectNaiveConvFwd:203.001,0,miopenConvolutionFwdAlgoDirect
1-1-3204-1x1-723-1-3204-16-0x0-1x1-1x1-0-NCHW-FP32-F=ConvBinWinogradRxSf2x3g1:0.963272,0,miopenConvolutionFwdAlgoWinograd;ConvBinWinogradRxSf3x2:0.69195,0,miopenConvolutionFwdAlgoWinograd;GemmFwd1x1_0_1:0.532279,0,miopenConvolutionFwdAlgoGEMM;ConvDirectNaiveConvFwd:1.82351,0,miopenConvolutionFwdAlgoDirect
1-1-3204-1x3-723-1-3204-16-0x1-1x1-1x1-0-NCHW-FP32-F=ConvBinWinogradRxSf2x3g1:0.886575,0,miopenConvolutionFwdAlgoWinograd;ConvBinWinogradRxSf3x2:0.723334,0,miopenConvolutionFwdAlgoWinograd;GemmFwdRest:0.821255,38448,miopenConvolutionFwdAlgoGEMM;ConvDirectNaiveConvFwd:3.239,0,miopenConvolutionFwdAlgoDirect
723-1-3204-1x3-723-1-3204-16-0x1-1x1-1x1-0-NCHW-FP32-F=ConvBinWinogradRxSf2x3g1:26.879,0,miopenConvolutionFwdAlgoWinograd;ConvBinWinogradRxSf3x2:35.1605,0,miopenConvolutionFwdAlgoWinograd;GemmFwdRest:19.5251,27797904,miopenConvolutionFwdAlgoGEMM;ConvDirectNaiveConvFwd:1125.64,0,miopenConvolutionFwdAlgoDirect
723-1-1602-1x1-942-1-1602-16-0x0-1x1-1x1-0-NCHW-FP32-F=ConvBinWinogradRxSf2x3g1:17.365,0,miopenConvolutionFwdAlgoWinograd;ConvBinWinogradRxSf3x2:11.8152,0,miopenConvolutionFwdAlgoWinograd;GemmFwd1x1_0_1:2.8911,0,miopenConvolutionFwdAlgoGEMM;ConvDirectNaiveConvFwd:281.418,0,miopenConvolutionFwdAlgoDirect
723-1-1602-1x3-942-1-1602-16-0x1-1x1-1x1-0-NCHW-FP32-F=ConvBinWinogradRxSf2x3g1:17.5492,0,miopenConvolutionFwdAlgoWinograd;ConvBinWinogradRxSf3x2:23.2262,0,miopenConvolutionFwdAlgoWinograd;GemmFwdRest:12.2771,13898952,miopenConvolutionFwdAlgoGEMM;ConvDirectNaiveConvFwd:726.936,0,miopenConvolutionFwdAlgoDirect
942-1-1602-1x3-942-1-1602-16-0x1-1x1-1x1-0-NCHW-FP32-F=ConvBinWinogradRxSf2x3g1:22.7344,0,miopenConvolutionFwdAlgoWinograd;ConvBinWinogradRxSf3x2:29.8992,0,miopenConvolutionFwdAlgoWinograd;GemmFwdRest:15.9401,18109008,miopenConvolutionFwdAlgoGEMM;ConvDirectNaiveConvFwd:946.784,0,miopenConvolutionFwdAlgoDirect
942-1-801-1x3-942-1-801-16-0x1-1x1-1x1-0-NCHW-FP32-F=ConvBinWinogradRxSf2x3g1:11.6705,0,miopenConvolutionFwdAlgoWinograd;ConvBinWinogradRxSf3x2:15.6352,0,miopenConvolutionFwdAlgoWinograd;GemmFwdRest:9.9238,9054504,miopenConvolutionFwdAlgoGEMM;ConvDirectNaiveConvFwd:507.646,0,miopenConvolutionFwdAlgoDirect
942-1-801-1x3-942-1-801-16-0x1-1x1-1x1-0-NCHW-FP32-B=ConvBinWinogradRxSf2x3g1:11.566,0,miopenConvolutionBwdDataAlgoWinograd;ConvBinWinogradRxSf3x2:15.0384,0,miopenConvolutionBwdDataAlgoWinograd;GemmBwdRest:6.48027,9054504,miopenConvolutionBwdDataAlgoGEMM;ConvDirectNaiveConvBwd:725.522,0,miopenConvolutionBwdDataAlgoDirect
942-1-801-1x3-942-1-801-16-0x1-1x1-1x1-0-NCHW-FP32-W=ConvBinWinogradRxSf2x3g1:16.8849,0,miopenConvolutionBwdWeightsAlgoWinograd;ConvBinWinogradRxSf2x3:16.9052,0,miopenConvolutionBwdWeightsAlgoWinograd;ConvBinWinogradRxSf3x2:14.0489,0,miopenConvolutionBwdWeightsAlgoWinograd;GemmWrwUniversal:8.49766,9054504,miopenConvolutionBwdWeightsAlgoGEMM;ConvDirectNaiveConvWrw:463.606,0,miopenConvolutionBwdWeightsAlgoDirect
942-1-1602-1x3-942-1-1602-16-0x1-1x1-1x1-0-NCHW-FP32-B=ConvBinWinogradRxSf2x3g1:22.8733,0,miopenConvolutionBwdDataAlgoWinograd;ConvBinWinogradRxSf3x2:29.9368,0,miopenConvolutionBwdDataAlgoWinograd;GemmBwdRest:12.095,18109008,miopenConvolutionBwdDataAlgoGEMM;ConvDirectNaiveConvBwd:1387.74,0,miopenConvolutionBwdDataAlgoDirect
942-1-1602-1x3-942-1-1602-16-0x1-1x1-1x1-0-NCHW-FP32-W=ConvBinWinogradRxSf2x3g1:34.3522,0,miopenConvolutionBwdWeightsAlgoWinograd;ConvBinWinogradRxSf2x3:34.1116,0,miopenConvolutionBwdWeightsAlgoWinograd;ConvBinWinogradRxSf3x2:32.7382,0,miopenConvolutionBwdWeightsAlgoWinograd;GemmWrwUniversal:16.4518,18109008,miopenConvolutionBwdWeightsAlgoGEMM;ConvDirectNaiveConvWrw:922.465,0,miopenConvolutionBwdWeightsAlgoDirect
942-1-1602-1x3-723-1-1602-16-0x1-1x1-1x1-0-NCHW-FP32-B=ConvBinWinogradRxSf2x3g1:17.6573,0,miopenConvolutionBwdDataAlgoWinograd;ConvBinWinogradRxSf3x2:22.7289,0,miopenConvolutionBwdDataAlgoWinograd;GemmBwdRest:10.0647,13898952,miopenConvolutionBwdDataAlgoGEMM;ConvDirectNaiveConvBwd:1062.82,0,miopenConvolutionBwdDataAlgoDirect
942-1-1602-1x3-723-1-1602-16-0x1-1x1-1x1-0-NCHW-FP32-W=ConvBinWinogradRxSf2x3g1:29.062,0,miopenConvolutionBwdWeightsAlgoWinograd;ConvBinWinogradRxSf2x3:29.1465,0,miopenConvolutionBwdWeightsAlgoWinograd;ConvBinWinogradRxSf3x2:22.1264,0,miopenConvolutionBwdWeightsAlgoWinograd;GemmWrwUniversal:14.0559,13898952,miopenConvolutionBwdWeightsAlgoGEMM;ConvDirectNaiveConvWrw:696.953,0,miopenConvolutionBwdWeightsAlgoDirect
942-1-1602-1x1-723-1-1602-16-0x0-1x1-1x1-0-NCHW-FP32-B=ConvBinWinogradRxSf2x3g1:17.4079,0,miopenConvolutionBwdDataAlgoWinograd;ConvBinWinogradRxSf3x2:11.5734,0,miopenConvolutionBwdDataAlgoWinograd;GemmBwd1x1_stride1:2.69856,0,miopenConvolutionBwdDataAlgoGEMM;ConvDirectNaiveConvBwd:438.036,0,miopenConvolutionBwdDataAlgoDirect
942-1-1602-1x1-723-1-1602-16-0x0-1x1-1x1-0-NCHW-FP32-W=ConvBinWinogradRxSf2x3:16.3045,0,miopenConvolutionBwdWeightsAlgoWinograd;ConvBinWinogradRxSf3x2:23.2482,0,miopenConvolutionBwdWeightsAlgoWinograd;ConvBinWinogradRxSf2x3g1:16.065,0,miopenConvolutionBwdWeightsAlgoWinograd;GemmWrw1x1_stride1:3.73367,0,miopenConvolutionBwdWeightsAlgoGEMM;ConvDirectNaiveConvWrw:1031.86,0,miopenConvolutionBwdWeightsAlgoDirect
723-1-3204-1x3-723-1-3204-16-0x1-1x1-1x1-0-NCHW-FP32-B=ConvBinWinogradRxSf2x3g1:27.0753,0,miopenConvolutionBwdDataAlgoWinograd;ConvBinWinogradRxSf3x2:35.1596,0,miopenConvolutionBwdDataAlgoWinograd;GemmBwdRest:14.8843,27797904,miopenConvolutionBwdDataAlgoGEMM;ConvDirectNaiveConvBwd:1639.98,0,miopenConvolutionBwdDataAlgoDirect
723-1-3204-1x3-723-1-3204-16-0x1-1x1-1x1-0-NCHW-FP32-W=ConvBinWinogradRxSf2x3g1:47.2523,0,miopenConvolutionBwdWeightsAlgoWinograd;ConvBinWinogradRxSf2x3:47.8181,0,miopenConvolutionBwdWeightsAlgoWinograd;ConvBinWinogradRxSf3x2:35.5169,0,miopenConvolutionBwdWeightsAlgoWinograd;GemmWrwUniversal:22.5494,27797904,miopenConvolutionBwdWeightsAlgoGEMM;ConvDirectNaiveConvWrw:1071.86,0,miopenConvolutionBwdWeightsAlgoDirect
723-1-3204-1x3-1-1-3204-16-0x1-1x1-1x1-0-NCHW-FP32-W=ConvBinWinogradRxSf2x3g1:1.99584,0,miopenConvolutionBwdWeightsAlgoWinograd;ConvBinWinogradRxSf2x3:2.02742,0,miopenConvolutionBwdWeightsAlgoWinograd;ConvBinWinogradRxSf3x2:2.86046,0,miopenConvolutionBwdWeightsAlgoWinograd;GemmWrwUniversal:2.31112,38448,miopenConvolutionBwdWeightsAlgoGEMM;ConvDirectNaiveConvWrw:64.288,0,miopenConvolutionBwdWeightsAlgoDirect
723-1-3204-1x1-1-1-3204-16-0x0-1x1-1x1-0-NCHW-FP32-W=ConvBinWinogradRxSf2x3:2.04137,0,miopenConvolutionBwdWeightsAlgoWinograd;ConvBinWinogradRxSf3x2:2.951,0,miopenConvolutionBwdWeightsAlgoWinograd;ConvBinWinogradRxSf2x3g1:2.01192,0,miopenConvolutionBwdWeightsAlgoWinograd;GemmWrw1x1_stride1:2.17948,0,miopenConvolutionBwdWeightsAlgoGEMM;ConvDirectNaiveConvWrw:64.9249,0,miopenConvolutionBwdWeightsAlgoDirect
1-1-3204-1x1-723-1-3204-10-0x0-1x1-1x1-0-NCHW-FP32-F=ConvBinWinogradRxSf2x3g1:0.49558,0,miopenConvolutionFwdAlgoWinograd;ConvBinWinogradRxSf3x2:0.480452,0,miopenConvolutionFwdAlgoWinograd;GemmFwd1x1_0_1:0.272634,0,miopenConvolutionFwdAlgoGEMM;ConvDirectNaiveConvFwd:0.73695,0,miopenConvolutionFwdAlgoDirect
1-1-3204-1x3-723-1-3204-10-0x1-1x1-1x1-0-NCHW-FP32-F=ConvBinWinogradRxSf2x3g1:0.500948,0,miopenConvolutionFwdAlgoWinograd;ConvBinWinogradRxSf3x2:0.46054,0,miopenConvolutionFwdAlgoWinograd;GemmFwdRest:0.44826,38448,miopenConvolutionFwdAlgoGEMM;ConvDirectNaiveConvFwd:2.01056,0,miopenConvolutionFwdAlgoDirect
723-1-3204-1x3-723-1-3204-10-0x1-1x1-1x1-0-NCHW-FP32-F=ConvBinWinogradRxSf2x3g1:16.9425,0,miopenConvolutionFwdAlgoWinograd;ConvBinWinogradRxSf3x2:21.7139,0,miopenConvolutionFwdAlgoWinograd;GemmFwdRest:12.2478,27797904,miopenConvolutionFwdAlgoGEMM;ConvDirectNaiveConvFwd:707.872,0,miopenConvolutionFwdAlgoDirect
723-1-1602-1x1-942-1-1602-10-0x0-1x1-1x1-0-NCHW-FP32-F=ConvBinWinogradRxSf2x3g1:10.9848,0,miopenConvolutionFwdAlgoWinograd;ConvBinWinogradRxSf3x2:7.24135,0,miopenConvolutionFwdAlgoWinograd;GemmFwd1x1_0_1:1.91574,0,miopenConvolutionFwdAlgoGEMM;ConvDirectNaiveConvFwd:176,0,miopenConvolutionFwdAlgoDirect
723-1-1602-1x3-942-1-1602-10-0x1-1x1-1x1-0-NCHW-FP32-F=ConvBinWinogradRxSf2x3g1:11.0029,0,miopenConvolutionFwdAlgoWinograd;ConvBinWinogradRxSf3x2:14.4238,0,miopenConvolutionFwdAlgoWinograd;GemmFwdRest:7.6983,13898952,miopenConvolutionFwdAlgoGEMM;ConvDirectNaiveConvFwd:456.555,0,miopenConvolutionFwdAlgoDirect
942-1-1602-1x3-942-1-1602-10-0x1-1x1-1x1-0-NCHW-FP32-F=ConvBinWinogradRxSf2x3g1:14.2336,0,miopenConvolutionFwdAlgoWinograd;ConvBinWinogradRxSf3x2:18.5802,0,miopenConvolutionFwdAlgoWinograd;GemmFwdRest:10.0776,18109008,miopenConvolutionFwdAlgoGEMM;ConvDirectNaiveConvFwd:590.994,0,miopenConvolutionFwdAlgoDirect
942-1-801-1x3-942-1-801-10-0x1-1x1-1x1-0-NCHW-FP32-F=ConvBinWinogradRxSf2x3g1:7.14343,0,miopenConvolutionFwdAlgoWinograd;ConvBinWinogradRxSf3x2:9.20594,0,miopenConvolutionFwdAlgoWinograd;GemmFwdRest:5.34528,9054504,miopenConvolutionFwdAlgoGEMM;ConvDirectNaiveConvFwd:318.342,0,miopenConvolutionFwdAlgoDirect
942-1-801-1x3-942-1-801-10-0x1-1x1-1x1-0-NCHW-FP32-B=ConvBinWinogradRxSf2x3g1:7.18587,0,miopenConvolutionBwdDataAlgoWinograd;ConvBinWinogradRxSf3x2:9.37058,0,miopenConvolutionBwdDataAlgoWinograd;GemmBwdRest:4.03117,9054504,miopenConvolutionBwdDataAlgoGEMM;ConvDirectNaiveConvBwd:454.436,0,miopenConvolutionBwdDataAlgoDirect
942-1-801-1x3-942-1-801-10-0x1-1x1-1x1-0-NCHW-FP32-W=ConvBinWinogradRxSf2x3g1:10.8737,0,miopenConvolutionBwdWeightsAlgoWinograd;ConvBinWinogradRxSf2x3:10.9322,0,miopenConvolutionBwdWeightsAlgoWinograd;ConvBinWinogradRxSf3x2:8.58577,0,miopenConvolutionBwdWeightsAlgoWinograd;GemmWrwUniversal:5.9718,9054504,miopenConvolutionBwdWeightsAlgoGEMM;ConvDirectNaiveConvWrw:290.272,0,miopenConvolutionBwdWeightsAlgoDirect
942-1-1602-1x3-942-1-1602-10-0x1-1x1-1x1-0-NCHW-FP32-B=ConvBinWinogradRxSf2x3g1:14.3728,0,miopenConvolutionBwdDataAlgoWinograd;ConvBinWinogradRxSf3x2:18.6845,0,miopenConvolutionBwdDataAlgoWinograd;GemmBwdRest:8.11428,18109008,miopenConvolutionBwdDataAlgoGEMM;ConvDirectNaiveConvBwd:862.57,0,miopenConvolutionBwdDataAlgoDirect
942-1-1602-1x3-942-1-1602-10-0x1-1x1-1x1-0-NCHW-FP32-W=ConvBinWinogradRxSf2x3g1:22.0322,0,miopenConvolutionBwdWeightsAlgoWinograd;ConvBinWinogradRxSf2x3:22.2105,0,miopenConvolutionBwdWeightsAlgoWinograd;ConvBinWinogradRxSf3x2:18.221,0,miopenConvolutionBwdWeightsAlgoWinograd;GemmWrwUniversal:10.9189,18109008,miopenConvolutionBwdWeightsAlgoGEMM;ConvDirectNaiveConvWrw:589.369,0,miopenConvolutionBwdWeightsAlgoDirect
942-1-1602-1x3-723-1-1602-10-0x1-1x1-1x1-0-NCHW-FP32-B=ConvBinWinogradRxSf2x3g1:11.0893,0,miopenConvolutionBwdDataAlgoWinograd;ConvBinWinogradRxSf3x2:14.4195,0,miopenConvolutionBwdDataAlgoWinograd;GemmBwdRest:6.24398,13898952,miopenConvolutionBwdDataAlgoGEMM;ConvDirectNaiveConvBwd:662.744,0,miopenConvolutionBwdDataAlgoDirect
942-1-1602-1x3-723-1-1602-10-0x1-1x1-1x1-0-NCHW-FP32-W=ConvBinWinogradRxSf2x3g1:18.0404,0,miopenConvolutionBwdWeightsAlgoWinograd;ConvBinWinogradRxSf2x3:18.3537,0,miopenConvolutionBwdWeightsAlgoWinograd;ConvBinWinogradRxSf3x2:13.9195,0,miopenConvolutionBwdWeightsAlgoWinograd;GemmWrwUniversal:8.56209,13898952,miopenConvolutionBwdWeightsAlgoGEMM;ConvDirectNaiveConvWrw:433.132,0,miopenConvolutionBwdWeightsAlgoDirect
942-1-1602-1x1-723-1-1602-10-0x0-1x1-1x1-0-NCHW-FP32-B=ConvBinWinogradRxSf2x3g1:10.9856,0,miopenConvolutionBwdDataAlgoWinograd;ConvBinWinogradRxSf3x2:7.32318,0,miopenConvolutionBwdDataAlgoWinograd;GemmBwd1x1_stride1:1.86715,0,miopenConvolutionBwdDataAlgoGEMM;ConvDirectNaiveConvBwd:273.75,0,miopenConvolutionBwdDataAlgoDirect
942-1-1602-1x1-723-1-1602-10-0x0-1x1-1x1-0-NCHW-FP32-W=ConvBinWinogradRxSf2x3:10.1962,0,miopenConvolutionBwdWeightsAlgoWinograd;ConvBinWinogradRxSf3x2:13.953,0,miopenConvolutionBwdWeightsAlgoWinograd;ConvBinWinogradRxSf2x3g1:9.92176,0,miopenConvolutionBwdWeightsAlgoWinograd;GemmWrw1x1_stride1:2.68531,0,miopenConvolutionBwdWeightsAlgoGEMM;ConvDirectNaiveConvWrw:609.828,0,miopenConvolutionBwdWeightsAlgoDirect
723-1-3204-1x3-723-1-3204-10-0x1-1x1-1x1-0-NCHW-FP32-B=ConvBinWinogradRxSf2x3g1:16.5698,0,miopenConvolutionBwdDataAlgoWinograd;ConvBinWinogradRxSf3x2:22.0987,0,miopenConvolutionBwdDataAlgoWinograd;GemmBwdRest:9.56045,27797904,miopenConvolutionBwdDataAlgoGEMM;ConvDirectNaiveConvBwd:1026.81,0,miopenConvolutionBwdDataAlgoDirect
723-1-3204-1x3-723-1-3204-10-0x1-1x1-1x1-0-NCHW-FP32-W=ConvBinWinogradRxSf2x3g1:29.139,0,miopenConvolutionBwdWeightsAlgoWinograd;ConvBinWinogradRxSf2x3:29.0899,0,miopenConvolutionBwdWeightsAlgoWinograd;ConvBinWinogradRxSf3x2:22.3137,0,miopenConvolutionBwdWeightsAlgoWinograd;GemmWrwUniversal:14.6672,27797904,miopenConvolutionBwdWeightsAlgoGEMM;ConvDirectNaiveConvWrw:672.422,0,miopenConvolutionBwdWeightsAlgoDirect
723-1-3204-1x3-1-1-3204-10-0x1-1x1-1x1-0-NCHW-FP32-W=ConvBinWinogradRxSf2x3g1:1.37786,0,miopenConvolutionBwdWeightsAlgoWinograd;ConvBinWinogradRxSf2x3:1.31457,0,miopenConvolutionBwdWeightsAlgoWinograd;ConvBinWinogradRxSf3x2:1.95846,0,miopenConvolutionBwdWeightsAlgoWinograd;GemmWrwUniversal:1.66695,38448,miopenConvolutionBwdWeightsAlgoGEMM;ConvDirectNaiveConvWrw:41.1744,0,miopenConvolutionBwdWeightsAlgoDirect
723-1-3204-1x1-1-1-3204-10-0x0-1x1-1x1-0-NCHW-FP32-W=ConvBinWinogradRxSf2x3:1.23079,0,miopenConvolutionBwdWeightsAlgoWinograd;ConvBinWinogradRxSf3x2:1.93923,0,miopenConvolutionBwdWeightsAlgoWinograd;ConvBinWinogradRxSf2x3g1:1.23651,0,miopenConvolutionBwdWeightsAlgoWinograd;GemmWrw1x1_stride1:1.50464,0,miopenConvolutionBwdWeightsAlgoGEMM;ConvDirectNaiveConvWrw:41.0126,0,miopenConvolutionBwdWeightsAlgoDirect
1-1-3204-1x1-723-1-3204-17-0x0-1x1-1x1-0-NCHW-FP32-F=ConvBinWinogradRxSf2x3g1:0.864431,0,miopenConvolutionFwdAlgoWinograd;ConvBinWinogradRxSf3x2:0.925015,0,miopenConvolutionFwdAlgoWinograd;GemmFwd1x1_0_1:0.610175,0,miopenConvolutionFwdAlgoGEMM;ConvDirectNaiveConvFwd:1.45214,0,miopenConvolutionFwdAlgoDirect
1-1-3204-1x3-723-1-3204-17-0x1-1x1-1x1-0-NCHW-FP32-F=ConvBinWinogradRxSf2x3g1:0.866015,0,miopenConvolutionFwdAlgoWinograd;ConvBinWinogradRxSf3x2:0.842711,0,miopenConvolutionFwdAlgoWinograd;GemmFwdRest:0.750949,38448,miopenConvolutionFwdAlgoGEMM;ConvDirectNaiveConvFwd:2.3943,0,miopenConvolutionFwdAlgoDirect
723-1-3204-1x3-723-1-3204-17-0x1-1x1-1x1-0-NCHW-FP32-F=ConvBinWinogradRxSf2x3g1:28.0935,0,miopenConvolutionFwdAlgoWinograd;ConvBinWinogradRxSf3x2:37.3379,0,miopenConvolutionFwdAlgoWinograd;GemmFwdRest:22.195,27797904,miopenConvolutionFwdAlgoGEMM;ConvDirectNaiveConvFwd:1192.92,0,miopenConvolutionFwdAlgoDirect
723-1-1602-1x1-942-1-1602-17-0x0-1x1-1x1-0-NCHW-FP32-F=ConvBinWinogradRxSf2x3g1:18.3948,0,miopenConvolutionFwdAlgoWinograd;ConvBinWinogradRxSf3x2:12.5536,0,miopenConvolutionFwdAlgoWinograd;GemmFwd1x1_0_1:3.45272,0,miopenConvolutionFwdAlgoGEMM;ConvDirectNaiveConvFwd:300.482,0,miopenConvolutionFwdAlgoDirect
723-1-1602-1x3-942-1-1602-17-0x1-1x1-1x1-0-NCHW-FP32-F=ConvBinWinogradRxSf2x3g1:18.6214,0,miopenConvolutionFwdAlgoWinograd;ConvBinWinogradRxSf3x2:24.4567,0,miopenConvolutionFwdAlgoWinograd;GemmFwdRest:14.0082,13898952,miopenConvolutionFwdAlgoGEMM;ConvDirectNaiveConvFwd:772.637,0,miopenConvolutionFwdAlgoDirect
942-1-1602-1x3-942-1-1602-17-0x1-1x1-1x1-0-NCHW-FP32-F=ConvBinWinogradRxSf2x3g1:24.0724,0,miopenConvolutionFwdAlgoWinograd;ConvBinWinogradRxSf3x2:31.6969,0,miopenConvolutionFwdAlgoWinograd;GemmFwdRest:17.8918,18109008,miopenConvolutionFwdAlgoGEMM;ConvDirectNaiveConvFwd:1003.95,0,miopenConvolutionFwdAlgoDirect
942-1-801-1x3-942-1-801-17-0x1-1x1-1x1-0-NCHW-FP32-F=ConvBinWinogradRxSf2x3g1:12.1408,0,miopenConvolutionFwdAlgoWinograd;ConvBinWinogradRxSf3x2:15.8909,0,miopenConvolutionFwdAlgoWinograd;GemmFwdRest:9.99847,9054504,miopenConvolutionFwdAlgoGEMM;ConvDirectNaiveConvFwd:538.809,0,miopenConvolutionFwdAlgoDirect
